[
  {
    "timestamp": "2024-06-19T12:23:00",
    "timestamp_text": "19/06/24, 12:23",
    "sender": null,
    "message": "Messages and calls are end-to-end encrypted. Only people in this chat can read, listen to, or share them. Learn more.",
    "type": "system"
  },
  {
    "timestamp": "2024-06-19T12:23:00",
    "timestamp_text": "19/06/24, 12:23",
    "sender": null,
    "message": "You created the group: Bengaluritage - Main",
    "type": "system"
  },
  {
    "timestamp": "2024-06-19T12:23:00",
    "timestamp_text": "19/06/24, 12:23",
    "sender": null,
    "message": "You changed this group's icon",
    "type": "system"
  },
  {
    "timestamp": "2024-06-19T12:24:00",
    "timestamp_text": "19/06/24, 12:24",
    "sender": null,
    "message": "You changed the group name from \"Bengaluru History - Main\" to \"Bengaluritage Nerds\"",
    "type": "system"
  },
  {
    "timestamp": "2024-06-19T18:47:00",
    "timestamp_text": "19/06/24, 18:47",
    "sender": null,
    "message": "You changed the group name from \"Bengaluritage Nerds\" to \"Bengaluru Heritage\"",
    "type": "system"
  },
  {
    "timestamp": "2024-06-20T14:27:00",
    "timestamp_text": "20/06/24, 14:27",
    "sender": null,
    "message": "You added Uma Sankar Sparklehood",
    "type": "system"
  },
  {
    "timestamp": "2024-06-21T15:01:00",
    "timestamp_text": "21/06/24, 15:01",
    "sender": null,
    "message": "You added Akshay Kulkarni Jio TA, Asha S K Sr. HR Administrator Unient and Sneha M HR Bounce",
    "type": "system"
  },
  {
    "timestamp": "2024-06-21T15:05:00",
    "timestamp_text": "21/06/24, 15:05",
    "sender": null,
    "message": "You added Anusha YD",
    "type": "system"
  },
  {
    "timestamp": "2024-06-21T15:16:00",
    "timestamp_text": "21/06/24, 15:16",
    "sender": "Suyash",
    "message": "Heritage walk #2 date announcement\n\nMy initial plan was to have the next #Bengaluritage walk 2 weeks after the 1st one. \n\nBut given the number of requests I'm getting for this Sunday's walk (Which is full), I'm happy to announce the date of our next walk:\n\nSaturday, June 29 | 9.00 AM | Brigade Road - MG Road\n\nJoin me and 14 other fellow Bengaluru heritage enthusiasts as we explore the rich history of the iconic stretch of Bangalore.",
    "type": "message"
  },
  {
    "timestamp": "2024-06-21T15:16:00",
    "timestamp_text": "21/06/24, 15:16",
    "sender": "Suyash",
    "message": "<Media omitted>",
    "type": "message"
  },
  {
    "timestamp": "2024-06-21T15:16:00",
    "timestamp_text": "21/06/24, 15:16",
    "sender": "Suyash",
    "message": "Block your spot: https://dhvo.short.gy/HW2",
    "type": "message"
  },
  {
    "timestamp": "2024-06-23T08:18:00",
    "timestamp_text": "23/06/24, 08:18",
    "sender": null,
    "message": "You added Suman Ghose Changemaker",
    "type": "system"
  },
  {
    "timestamp": "2024-06-23T14:05:00",
    "timestamp_text": "23/06/24, 14:05",
    "sender": null,
    "message": "You changed the group name from \"Bengaluru Heritage\" to \"Bengaluritage - Main\"",
    "type": "system"
  },
  {
    "timestamp": "2024-06-23T16:07:00",
    "timestamp_text": "23/06/24, 16:07",
    "sender": null,
    "message": "You added Self Community",
    "type": "system"
  },
  {
    "timestamp": "2024-06-24T09:47:00",
    "timestamp_text": "24/06/24, 09:47",
    "sender": null,
    "message": "Vani Subramaniam Heritage Walk requested to join.",
    "type": "system"
  },
  {
    "timestamp": "2024-06-24T11:35:00",
    "timestamp_text": "24/06/24, 11:35",
    "sender": null,
    "message": "Vani Subramaniam Heritage Walk joined using a group link.",
    "type": "system"
  },
  {
    "timestamp": "2024-06-26T12:17:00",
    "timestamp_text": "26/06/24, 12:17",
    "sender": "Suyash",
    "message": "<Media omitted>",
    "type": "message"
  },
  {
    "timestamp": "2024-06-26T12:20:00",
    "timestamp_text": "26/06/24, 12:20",
    "sender": "Suyash",
    "message": "<Media omitted>",
    "type": "message"
  },
  {
    "timestamp": "2024-06-26T12:20:00",
    "timestamp_text": "26/06/24, 12:20",
    "sender": "Suyash",
    "message": "<Media omitted>",
    "type": "message"
  },
  {
    "timestamp": "2024-06-26T12:21:00",
    "timestamp_text": "26/06/24, 12:21",
    "sender": "Suyash",
    "message": "<Media omitted>",
    "type": "message"
  },
  {
    "timestamp": "2024-06-26T12:21:00",
    "timestamp_text": "26/06/24, 12:21",
    "sender": "Suyash",
    "message": "<Media omitted>",
    "type": "message"
  },
  {
    "timestamp": "2024-06-26T12:22:00",
    "timestamp_text": "26/06/24, 12:22",
    "sender": "Suyash",
    "message": "Shared by someone I follow on Twitter. \nFull thread here: https://x.com/Enola_guy12/status/1805709074245501032?t=N2lxi0UZdW5rIGX0maF9Wg&s=19",
    "type": "message"
  },
  {
    "timestamp": "2024-06-26T12:24:00",
    "timestamp_text": "26/06/24, 12:24",
    "sender": "Suyash",
    "message": "In my hometown of Dehradun, there's a hiking trail to Mussoorie. It's the original travel route to the hill station established in 1824.\nIt's called the Kipling trail because Kipling used to use it.",
    "type": "message"
  },
  {
    "timestamp": "2024-06-26T12:25:00",
    "timestamp_text": "26/06/24, 12:25",
    "sender": "Suyash",
    "message": "I took the trail in May 2022. 14km, 4 hours",
    "type": "message"
  },
  {
    "timestamp": "2024-06-26T12:25:00",
    "timestamp_text": "26/06/24, 12:25",
    "sender": "Suyash",
    "message": "Anyone else got any fav historical fact or experience?",
    "type": "message"
  },
  {
    "timestamp": "2024-06-26T12:35:00",
    "timestamp_text": "26/06/24, 12:35",
    "sender": null,
    "message": "Gaurav Manipal requested to join.",
    "type": "system"
  },
  {
    "timestamp": "2024-06-26T12:37:00",
    "timestamp_text": "26/06/24, 12:37",
    "sender": null,
    "message": "Gaurav Manipal joined using a group link.",
    "type": "system"
  },
  {
    "timestamp": "2024-06-26T13:28:00",
    "timestamp_text": "26/06/24, 13:28",
    "sender": null,
    "message": "Dinesh Camera Traveller Heritage Walk requested to join.",
    "type": "system"
  },
  {
    "timestamp": "2024-06-26T14:51:00",
    "timestamp_text": "26/06/24, 14:51",
    "sender": null,
    "message": "Pradeep Book requested to join.",
    "type": "system"
  },
  {
    "timestamp": "2024-06-26T16:16:00",
    "timestamp_text": "26/06/24, 16:16",
    "sender": null,
    "message": "Pradeep Book joined using a group link.",
    "type": "system"
  },
  {
    "timestamp": "2024-06-26T16:16:00",
    "timestamp_text": "26/06/24, 16:16",
    "sender": null,
    "message": "Dinesh Camera Traveller Heritage Walk joined from the community",
    "type": "system"
  },
  {
    "timestamp": "2024-06-27T09:42:00",
    "timestamp_text": "27/06/24, 09:42",
    "sender": null,
    "message": "Suyash: You deleted this message",
    "type": "system"
  },
  {
    "timestamp": "2024-06-27T10:19:00",
    "timestamp_text": "27/06/24, 10:19",
    "sender": "Suyash",
    "message": "<Media omitted>",
    "type": "message"
  },
  {
    "timestamp": "2024-06-27T10:19:00",
    "timestamp_text": "27/06/24, 10:19",
    "sender": "Suyash",
    "message": "Please register and spread the word!",
    "type": "message"
  },
  {
    "timestamp": "2024-06-27T10:19:00",
    "timestamp_text": "27/06/24, 10:19",
    "sender": "Suyash",
    "message": "https://dhvo.short.gy/HW2",
    "type": "message"
  },
  {
    "timestamp": "2024-06-27T14:37:00",
    "timestamp_text": "27/06/24, 14:37",
    "sender": "Suyash",
    "message": "https://x.com/PicoPaco17/status/1806088793977425945?t=UJtTP6Hb426OSo517jBQHQ&s=08",
    "type": "message"
  },
  {
    "timestamp": "2024-06-27T14:37:00",
    "timestamp_text": "27/06/24, 14:37",
    "sender": "Suyash",
    "message": "Someone used AI to make \"restored footage\" of the Roman Empire",
    "type": "message"
  },
  {
    "timestamp": "2024-06-27T14:39:00",
    "timestamp_text": "27/06/24, 14:39",
    "sender": "Suyash",
    "message": "Original source: https://www.reddit.com/r/midjourney/s/T1AgCStwR9",
    "type": "message"
  },
  {
    "timestamp": "2024-06-27T14:43:00",
    "timestamp_text": "27/06/24, 14:43",
    "sender": "Suyash",
    "message": "Did you know, there was at least some level of trade between Bangalore area and Romans at least 1700 years ago?",
    "type": "message"
  },
  {
    "timestamp": "2024-06-27T14:44:00",
    "timestamp_text": "27/06/24, 14:44",
    "sender": "Suyash",
    "message": "In 1891, while constructing a railway line in Yeshwantpur, 163 Roman silver coins including ones bearing the faces of Augustus, Tiberius and Claudius were discovered.",
    "type": "message"
  },
  {
    "timestamp": "2024-06-27T14:44:00",
    "timestamp_text": "27/06/24, 14:44",
    "sender": "Suyash",
    "message": "In 1965, while constructing a runway at the old HAL airport, a pot containing 256 Roman silver coins was found",
    "type": "message"
  },
  {
    "timestamp": "2024-06-27T14:44:00",
    "timestamp_text": "27/06/24, 14:44",
    "sender": "Suyash",
    "message": "For context, the Roman empire fell in 476 CE",
    "type": "message"
  },
  {
    "timestamp": "2024-06-27T17:23:00",
    "timestamp_text": "27/06/24, 17:23",
    "sender": "Dinesh Camera Traveller Heritage Walk",
    "message": "<Media omitted>",
    "type": "message"
  },
  {
    "timestamp": "2024-06-27T17:24:00",
    "timestamp_text": "27/06/24, 17:24",
    "sender": "Self Community",
    "message": "I'm gonna let others answer",
    "type": "message"
  },
  {
    "timestamp": "2024-06-27T22:45:00",
    "timestamp_text": "27/06/24, 22:45",
    "sender": "Dinesh Camera Traveller Heritage Walk",
    "message": "None? Give a try folks",
    "type": "message"
  },
  {
    "timestamp": "2024-06-27T22:55:00",
    "timestamp_text": "27/06/24, 22:55",
    "sender": "Dinesh Camera Traveller Heritage Walk",
    "message": "Alright! These structures are called Kempegowda watch towers, adapted by the city municipal body in recognition of the city's founder.\nBuilt by Kempe Gowda I, These four watch towers marked the boundary of the city which has now way grown beyond those boundaries. If you're around Lal Bagh, Mekhri Circle, Gavipuram, or Ulsoor, do stop by to witness the history unfold. Also, today marks the mighty Kempe Gowda's Birthday!",
    "type": "message"
  },
  {
    "timestamp": "2024-06-28T14:10:00",
    "timestamp_text": "28/06/24, 14:10",
    "sender": "Suyash",
    "message": "So small correction. The towers were built by Kempegowda I's successor, Immadi Kempegowda alias Kempegowda II",
    "type": "message"
  },
  {
    "timestamp": "2024-06-28T14:11:00",
    "timestamp_text": "28/06/24, 14:11",
    "sender": "Suyash",
    "message": "The towers were built in 1597\nKempegowda 1 passed away in 1569",
    "type": "message"
  },
  {
    "timestamp": "2024-06-28T14:13:00",
    "timestamp_text": "28/06/24, 14:13",
    "sender": "Suyash",
    "message": "Good article: https://bangaloremirror.indiatimes.com/bangalore/others/keeping-an-eye-out-for-the-city/articleshow/60329365.cms",
    "type": "message"
  },
  {
    "timestamp": "2024-06-28T14:16:00",
    "timestamp_text": "28/06/24, 14:16",
    "sender": "Dinesh Camera Traveller Heritage Walk",
    "message": "Thanks for this Suyash.\nright, right. Kempe Gowda II laid these.\n Kempe Gowda I was the founder of BLR.",
    "type": "message"
  },
  {
    "timestamp": "2024-06-28T14:17:00",
    "timestamp_text": "28/06/24, 14:17",
    "sender": "Suyash",
    "message": "Unfortunately, a lot of articles do credit Kempegowda 1 for this",
    "type": "message"
  },
  {
    "timestamp": "2024-06-28T14:18:00",
    "timestamp_text": "28/06/24, 14:18",
    "sender": "Dinesh Camera Traveller Heritage Walk",
    "message": "Agree, quite many.",
    "type": "message"
  },
  {
    "timestamp": "2024-06-29T11:31:00",
    "timestamp_text": "29/06/24, 11:31",
    "sender": null,
    "message": "Pallavi T Sr. TA Specialist Leap requested to join.",
    "type": "system"
  },
  {
    "timestamp": "2024-06-29T12:37:00",
    "timestamp_text": "29/06/24, 12:37",
    "sender": null,
    "message": "Pallavi T Sr. TA Specialist Leap joined from the community",
    "type": "system"
  },
  {
    "timestamp": "2024-06-29T14:56:00",
    "timestamp_text": "29/06/24, 14:56",
    "sender": "Suyash",
    "message": "https://docs.google.com/forms/d/e/1FAIpQLSeDyhfD6AFjiUVDdm36uWM7MnSTqykj7uhnXb3RA2ih6ucrgA/viewform",
    "type": "message"
  },
  {
    "timestamp": "2024-06-29T14:56:00",
    "timestamp_text": "29/06/24, 14:56",
    "sender": "Suyash",
    "message": "I'm attending this tomorrow. Sharing in case it's of interest to any of you too",
    "type": "message"
  },
  {
    "timestamp": "2024-06-29T14:57:00",
    "timestamp_text": "29/06/24, 14:57",
    "sender": "Suyash",
    "message": "https://www.instagram.com/p/C8rjf8uN1WB/?igsh=YjQ2Zm43YnV6N2Y=",
    "type": "message"
  },
  {
    "timestamp": "2024-06-30T18:42:00",
    "timestamp_text": "30/06/24, 18:42",
    "sender": null,
    "message": "Uma Sankar Sparklehood left",
    "type": "system"
  },
  {
    "timestamp": "2024-06-30T23:35:00",
    "timestamp_text": "30/06/24, 23:35",
    "sender": "Suyash",
    "message": "When Hellen Keller met Rabindranath Tagore\nhttps://www.instagram.com/p/C817qJOSvXv/?igsh=MWo2bGt2cHR1YWdmaQ==",
    "type": "message"
  },
  {
    "timestamp": "2024-07-01T10:22:00",
    "timestamp_text": "01/07/24, 10:22",
    "sender": "Suyash",
    "message": "POLL:\nHave you been to Srirangapatna?\nOPTION: Yes (4 votes)\nOPTION: No (2 votes)\n",
    "type": "message"
  },
  {
    "timestamp": "2024-07-01T17:32:00",
    "timestamp_text": "01/07/24, 17:32",
    "sender": "Suyash",
    "message": "<Media omitted>",
    "type": "message"
  },
  {
    "timestamp": "2024-07-01T17:32:00",
    "timestamp_text": "01/07/24, 17:32",
    "sender": "Suyash",
    "message": "What can you tell me about it?",
    "type": "message"
  },
  {
    "timestamp": "2024-07-01T17:38:00",
    "timestamp_text": "01/07/24, 17:38",
    "sender": "Anusha YD",
    "message": "Haven't seen this. Visited the temple alone",
    "type": "message"
  },
  {
    "timestamp": "2024-07-01T18:15:00",
    "timestamp_text": "01/07/24, 18:15",
    "sender": "Suyash",
    "message": "You've missed a big opportunity by not visiting the museum there",
    "type": "message"
  },
  {
    "timestamp": "2024-07-01T18:15:00",
    "timestamp_text": "01/07/24, 18:15",
    "sender": "Suyash",
    "message": "It's in a part of the palace that's still preserved",
    "type": "message"
  },
  {
    "timestamp": "2024-07-01T18:15:00",
    "timestamp_text": "01/07/24, 18:15",
    "sender": "Suyash",
    "message": "This is displayed there as the painting of a young Tipu Sultan",
    "type": "message"
  },
  {
    "timestamp": "2024-07-01T18:16:00",
    "timestamp_text": "01/07/24, 18:16",
    "sender": "Suyash",
    "message": "But 3 years back, a person analysed it",
    "type": "message"
  },
  {
    "timestamp": "2024-07-01T18:17:00",
    "timestamp_text": "01/07/24, 18:17",
    "sender": "Suyash",
    "message": "According to him, this isn't Tipu and the painting is misattributed",
    "type": "message"
  },
  {
    "timestamp": "2024-07-01T18:17:00",
    "timestamp_text": "01/07/24, 18:17",
    "sender": "Suyash",
    "message": "Read the detailed article here:\nhttps://amp.scroll.in/article/1010779/i-looked-closely-at-two-famous-portraits-of-tipu-sultan-and-found-that-one-isnt-actually-of-him",
    "type": "message"
  },
  {
    "timestamp": "2024-07-02T15:08:00",
    "timestamp_text": "02/07/24, 15:08",
    "sender": "Suyash",
    "message": "<Media omitted>",
    "type": "message"
  },
  {
    "timestamp": "2024-07-02T15:09:00",
    "timestamp_text": "02/07/24, 15:09",
    "sender": null,
    "message": "You added Kiranmayi Kalepalli Senior Recruiter Capgemini",
    "type": "system"
  },
  {
    "timestamp": "2024-07-02T16:19:00",
    "timestamp_text": "02/07/24, 16:19",
    "sender": null,
    "message": "Soniya Jennifer Bengaluritage joined using your invite",
    "type": "system"
  },
  {
    "timestamp": "2024-07-03T13:40:00",
    "timestamp_text": "03/07/24, 13:40",
    "sender": null,
    "message": "Self Community added Aadhya Shah Bengaluritage, Akshita Mehta Bengaluritage, Austin Dsouza Bengaluritage, Ayush Pranav Bengaluritage, Laksha YD and Sujan Gowda Bengaluritage",
    "type": "system"
  },
  {
    "timestamp": "2024-07-03T15:10:00",
    "timestamp_text": "03/07/24, 15:10",
    "sender": "Ayush Pranav Bengaluritage",
    "message": "Thanks for adding me to the group, @⁨Self Community⁩",
    "type": "message"
  },
  {
    "timestamp": "2024-07-03T15:10:00",
    "timestamp_text": "03/07/24, 15:10",
    "sender": "Ayush Pranav Bengaluritage",
    "message": "I'm Ayush and I work with a venture firm in Bangalore. I like to go on heritage walks, hikes and photography. Excited to be a part of the group :)",
    "type": "message"
  },
  {
    "timestamp": "2024-07-03T16:24:00",
    "timestamp_text": "03/07/24, 16:24",
    "sender": "Self Community",
    "message": "Welcome to Bengaluritage Ayush",
    "type": "message"
  },
  {
    "timestamp": "2024-07-03T16:25:00",
    "timestamp_text": "03/07/24, 16:25",
    "sender": "Self Community",
    "message": "Any fav historical fact about the city that you or anyone else would like to share?",
    "type": "message"
  },
  {
    "timestamp": "2024-07-03T16:45:00",
    "timestamp_text": "03/07/24, 16:45",
    "sender": "Akshita Mehta Bengaluritage",
    "message": "Hello \nThank you for adding me to this group..\n I'm Akshita Mehta . I'm a freelancer interior designer...\nI'm in Bangalore from 2020..",
    "type": "message"
  },
  {
    "timestamp": "2024-07-03T16:46:00",
    "timestamp_text": "03/07/24, 16:46",
    "sender": "Laksha YD",
    "message": "Hey all. I am Laksha, I am a psychologist based in Bangalore. I've been born and raised in Blr. Nice to be here 💝",
    "type": "message"
  },
  {
    "timestamp": "2024-07-03T16:59:00",
    "timestamp_text": "03/07/24, 16:59",
    "sender": "Self Community",
    "message": "Welcome @⁨Akshita Mehta Bengaluritage⁩, @⁨Laksha YD⁩",
    "type": "message"
  },
  {
    "timestamp": "2024-07-03T17:00:00",
    "timestamp_text": "03/07/24, 17:00",
    "sender": "Self Community",
    "message": "POLL:\nWho created Lalbagh?\nOPTION: British govt (0 votes)\nOPTION: Wodeyars (1 vote)\nOPTION: Hyder Ali (3 votes)\nOPTION: Kempegowda I (1 vote)\n",
    "type": "message"
  },
  {
    "timestamp": "2024-07-03T17:32:00",
    "timestamp_text": "03/07/24, 17:32",
    "sender": "Suyash",
    "message": "Well 3 of you got it right <This message was edited>",
    "type": "message"
  },
  {
    "timestamp": "2024-07-03T17:33:00",
    "timestamp_text": "03/07/24, 17:33",
    "sender": "Self Community",
    "message": "The answer is indeed Hyder Ali",
    "type": "message"
  },
  {
    "timestamp": "2024-07-03T17:33:00",
    "timestamp_text": "03/07/24, 17:33",
    "sender": "Self Community",
    "message": "The park was commissioned by him in 1760",
    "type": "message"
  },
  {
    "timestamp": "2024-07-03T17:34:00",
    "timestamp_text": "03/07/24, 17:34",
    "sender": "Self Community",
    "message": "His son Tipu Sultan completed it after his death",
    "type": "message"
  },
  {
    "timestamp": "2024-07-03T17:34:00",
    "timestamp_text": "03/07/24, 17:34",
    "sender": "Pallavi T Sr. TA Specialist Leap",
    "message": "https://www.amazon.in/Bangalores-Lalbagh-Chronicle-Garden-City/dp/8195347207\n\nThis is a great book to read about Lalbagh and it's history and how its come to be what it is right now.",
    "type": "message"
  },
  {
    "timestamp": "2024-07-03T17:36:00",
    "timestamp_text": "03/07/24, 17:36",
    "sender": "Vani Subramaniam Heritage Walk",
    "message": "I have the one on Lalbagh by vijay Tiruvady which is also pretty informative and he was one of the OG lal bagh walkers :)",
    "type": "message"
  },
  {
    "timestamp": "2024-07-03T17:52:00",
    "timestamp_text": "03/07/24, 17:52",
    "sender": "Self Community",
    "message": "@⁨Vani Subramaniam Heritage Walk⁩ @⁨Pallavi T Sr. TA Specialist Leap⁩ Any trivia from either book that you really loves? Please do share",
    "type": "message"
  },
  {
    "timestamp": "2024-07-03T17:52:00",
    "timestamp_text": "03/07/24, 17:52",
    "sender": "Austin Dsouza Bengaluritage",
    "message": "Hello all, I’m Austin DSouza here. Thank you for adding me in the group. I’m a finance professional who was born and raised abroad but in Blr for the past 6 years for study and work. Excited to be here !!",
    "type": "message"
  },
  {
    "timestamp": "2024-07-03T17:52:00",
    "timestamp_text": "03/07/24, 17:52",
    "sender": "Self Community",
    "message": "Welcome to the community Austin",
    "type": "message"
  },
  {
    "timestamp": "2024-07-03T17:54:00",
    "timestamp_text": "03/07/24, 17:54",
    "sender": "Anusha YD",
    "message": "Warm welcome y'all!",
    "type": "message"
  },
  {
    "timestamp": "2024-07-03T18:04:00",
    "timestamp_text": "03/07/24, 18:04",
    "sender": "Laksha YD",
    "message": "It's a beautiful book ✌️",
    "type": "message"
  },
  {
    "timestamp": "2024-07-03T18:04:00",
    "timestamp_text": "03/07/24, 18:04",
    "sender": null,
    "message": "Suyash: You deleted this message",
    "type": "system"
  },
  {
    "timestamp": "2024-07-03T18:04:00",
    "timestamp_text": "03/07/24, 18:04",
    "sender": "Vani Subramaniam Heritage Walk",
    "message": "ehhhh i have the same book",
    "type": "message"
  },
  {
    "timestamp": "2024-07-03T18:04:00",
    "timestamp_text": "03/07/24, 18:04",
    "sender": "Vani Subramaniam Heritage Walk",
    "message": "or did :p before it disappeared from here",
    "type": "message"
  },
  {
    "timestamp": "2024-07-03T18:05:00",
    "timestamp_text": "03/07/24, 18:05",
    "sender": "Self Community",
    "message": "<Media omitted>",
    "type": "message"
  },
  {
    "timestamp": "2024-07-03T18:05:00",
    "timestamp_text": "03/07/24, 18:05",
    "sender": "Self Community",
    "message": "Lol sorry\nI was replying from my other number",
    "type": "message"
  },
  {
    "timestamp": "2024-07-03T18:05:00",
    "timestamp_text": "03/07/24, 18:05",
    "sender": "Self Community",
    "message": "<Media omitted>",
    "type": "message"
  },
  {
    "timestamp": "2024-07-03T18:30:00",
    "timestamp_text": "03/07/24, 18:30",
    "sender": null,
    "message": "Suyash: You deleted this message",
    "type": "system"
  },
  {
    "timestamp": "2024-07-03T18:31:00",
    "timestamp_text": "03/07/24, 18:31",
    "sender": "Self Community",
    "message": "Btw, announcing my next walk here first before I announce it publicly tomorrow",
    "type": "message"
  },
  {
    "timestamp": "2024-07-03T18:31:00",
    "timestamp_text": "03/07/24, 18:31",
    "sender": "Self Community",
    "message": "<Media omitted>",
    "type": "message"
  },
  {
    "timestamp": "2024-07-03T18:31:00",
    "timestamp_text": "03/07/24, 18:31",
    "sender": "Self Community",
    "message": "Reg link: https://dhvo.short.gy/HW3",
    "type": "message"
  },
  {
    "timestamp": "2024-07-03T18:31:00",
    "timestamp_text": "03/07/24, 18:31",
    "sender": "Self Community",
    "message": "If you haven't attended this walk yet, do register please",
    "type": "message"
  },
  {
    "timestamp": "2024-07-03T18:36:00",
    "timestamp_text": "03/07/24, 18:36",
    "sender": null,
    "message": "Aadhya Shah Bengaluritage left",
    "type": "system"
  },
  {
    "timestamp": "2024-07-03T18:37:00",
    "timestamp_text": "03/07/24, 18:37",
    "sender": null,
    "message": "Aadhya Shah Bengaluritage requested to join.",
    "type": "system"
  },
  {
    "timestamp": "2024-07-03T18:37:00",
    "timestamp_text": "03/07/24, 18:37",
    "sender": null,
    "message": "Aadhya Shah Bengaluritage joined using a group link.",
    "type": "system"
  },
  {
    "timestamp": "2024-07-03T19:42:00",
    "timestamp_text": "03/07/24, 19:42",
    "sender": "Self Community",
    "message": "Anyone here got any good history podcast recommendations?",
    "type": "message"
  },
  {
    "timestamp": "2024-07-03T19:49:00",
    "timestamp_text": "03/07/24, 19:49",
    "sender": "Anusha YD",
    "message": "Yup..\n1.Live history India\n2.Brown History.\nThese are my personal favorites. Their blog stories are amazing too",
    "type": "message"
  },
  {
    "timestamp": "2024-07-03T19:57:00",
    "timestamp_text": "03/07/24, 19:57",
    "sender": "Self Community",
    "message": "Yeah I love LHI too",
    "type": "message"
  },
  {
    "timestamp": "2024-07-03T20:10:00",
    "timestamp_text": "03/07/24, 20:10",
    "sender": "Self Community",
    "message": "LHI podcast:\nhttps://podnews.net/podcast/i3or8",
    "type": "message"
  },
  {
    "timestamp": "2024-07-03T20:11:00",
    "timestamp_text": "03/07/24, 20:11",
    "sender": "Self Community",
    "message": "Blog/Website \nhttps://www.peepultree.world/livehistoryindia",
    "type": "message"
  },
  {
    "timestamp": "2024-07-03T20:12:00",
    "timestamp_text": "03/07/24, 20:12",
    "sender": "Self Community",
    "message": "This is my fav article by them:\nhttps://www.peepultree.world/livehistoryindia/story/living-culture/pav-from-the-nau-indias-portuguese-food-trail",
    "type": "message"
  },
  {
    "timestamp": "2024-07-03T20:12:00",
    "timestamp_text": "03/07/24, 20:12",
    "sender": "Self Community",
    "message": "It talks about the invention of pav",
    "type": "message"
  },
  {
    "timestamp": "2024-07-03T20:14:00",
    "timestamp_text": "03/07/24, 20:14",
    "sender": "Self Community",
    "message": "Also the food articles that are used in our regular Indian cooking which were actually brought to India by the Portuguese in early 15th century:\n1. Tomato \n2. Potato \n3. Chilli\n4. Capsicum \n5. Peanuts \n6. Rajma\n7. Corn <This message was edited>",
    "type": "message"
  },
  {
    "timestamp": "2024-07-03T20:15:00",
    "timestamp_text": "03/07/24, 20:15",
    "sender": "Self Community",
    "message": "Also:\n1. Guava\n2. Papaya\n3. Chiku/Sapota\n4. Cashew\n5. Pineapple \netc.",
    "type": "message"
  },
  {
    "timestamp": "2024-07-03T20:17:00",
    "timestamp_text": "03/07/24, 20:17",
    "sender": null,
    "message": "Self Community: This message was deleted",
    "type": "system"
  },
  {
    "timestamp": "2024-07-03T20:18:00",
    "timestamp_text": "03/07/24, 20:18",
    "sender": "Self Community",
    "message": "Brown History podcast \nhttps://podnews.net/podcast/i4hv6",
    "type": "message"
  },
  {
    "timestamp": "2024-07-03T20:19:00",
    "timestamp_text": "03/07/24, 20:19",
    "sender": "Self Community",
    "message": "https://brownhistory.substack.com/",
    "type": "message"
  },
  {
    "timestamp": "2024-07-03T20:19:00",
    "timestamp_text": "03/07/24, 20:19",
    "sender": "Self Community",
    "message": "POLL:\nPick the odd one out\nOPTION: Shampoo (0 votes)\nOPTION: Ketchup (0 votes)\nOPTION: Juggernaut (2 votes)\nOPTION: Cummerbund (1 vote)\n",
    "type": "message"
  },
  {
    "timestamp": "2024-07-03T20:27:00",
    "timestamp_text": "03/07/24, 20:27",
    "sender": "Self Community",
    "message": "Think word origins",
    "type": "message"
  },
  {
    "timestamp": "2024-07-03T21:52:00",
    "timestamp_text": "03/07/24, 21:52",
    "sender": "Suyash",
    "message": "@⁨Anusha YD⁩ @⁨Kiranmayi Kalepalli Senior Recruiter Capgemini⁩ What's the story behind Juggernaut that led you to choose that option?",
    "type": "message"
  },
  {
    "timestamp": "2024-07-03T22:23:00",
    "timestamp_text": "03/07/24, 22:23",
    "sender": "Anusha YD",
    "message": "I'm thinking Juggernaut is of British origin and the rest had some Asian/eastern ties.. atleast from what I read of the world' meaning",
    "type": "message"
  },
  {
    "timestamp": "2024-07-03T23:03:00",
    "timestamp_text": "03/07/24, 23:03",
    "sender": "Self Community",
    "message": "You're on exactly the right path",
    "type": "message"
  },
  {
    "timestamp": "2024-07-03T23:03:00",
    "timestamp_text": "03/07/24, 23:03",
    "sender": "Self Community",
    "message": "The answer is \"ketchup\"",
    "type": "message"
  },
  {
    "timestamp": "2024-07-03T23:04:00",
    "timestamp_text": "03/07/24, 23:04",
    "sender": "Self Community",
    "message": "Ketchup is the only 1 of these not derived from Sanskrit",
    "type": "message"
  },
  {
    "timestamp": "2024-07-03T23:04:00",
    "timestamp_text": "03/07/24, 23:04",
    "sender": "Self Community",
    "message": "Shampoo derives from champi/champu or head massage",
    "type": "message"
  },
  {
    "timestamp": "2024-07-03T23:04:00",
    "timestamp_text": "03/07/24, 23:04",
    "sender": "Self Community",
    "message": "Juggernaut derives from Jagannath",
    "type": "message"
  },
  {
    "timestamp": "2024-07-03T23:05:00",
    "timestamp_text": "03/07/24, 23:05",
    "sender": "Self Community",
    "message": "Cummerbund from..well...cummerband <This message was edited>",
    "type": "message"
  },
  {
    "timestamp": "2024-07-03T23:05:00",
    "timestamp_text": "03/07/24, 23:05",
    "sender": "Kiranmayi Kalepalli Senior Recruiter Capgemini",
    "message": "This is toughest question",
    "type": "message"
  },
  {
    "timestamp": "2024-07-03T23:06:00",
    "timestamp_text": "03/07/24, 23:06",
    "sender": "Self Community",
    "message": "Lol, it's definitely a tough one",
    "type": "message"
  },
  {
    "timestamp": "2024-07-03T23:06:00",
    "timestamp_text": "03/07/24, 23:06",
    "sender": "Self Community",
    "message": "There are many origins given for ketchup",
    "type": "message"
  },
  {
    "timestamp": "2024-07-03T23:06:00",
    "timestamp_text": "03/07/24, 23:06",
    "sender": "Kiranmayi Kalepalli Senior Recruiter Capgemini",
    "message": "Hmmm 🧐",
    "type": "message"
  },
  {
    "timestamp": "2024-07-03T23:07:00",
    "timestamp_text": "03/07/24, 23:07",
    "sender": "Self Community",
    "message": "The most commonly accepted one is that the origin is _kichap_, a Malay word",
    "type": "message"
  },
  {
    "timestamp": "2024-07-03T23:08:00",
    "timestamp_text": "03/07/24, 23:08",
    "sender": "Self Community",
    "message": "Which was a fish sauce",
    "type": "message"
  },
  {
    "timestamp": "2024-07-03T23:08:00",
    "timestamp_text": "03/07/24, 23:08",
    "sender": "Self Community",
    "message": "But there's also an alternative origin which comes from Karnataka",
    "type": "message"
  },
  {
    "timestamp": "2024-07-03T23:09:00",
    "timestamp_text": "03/07/24, 23:09",
    "sender": "Self Community",
    "message": "That ketchup derives from the Tulu word _kajipu_",
    "type": "message"
  },
  {
    "timestamp": "2024-07-03T23:09:00",
    "timestamp_text": "03/07/24, 23:09",
    "sender": "Self Community",
    "message": "Which means curry",
    "type": "message"
  },
  {
    "timestamp": "2024-07-04T11:39:00",
    "timestamp_text": "04/07/24, 11:39",
    "sender": "Self Community",
    "message": "Good morning folks. I've been hooked to this podcast which recently launched. Only 1 dedicated entirely to the history of Bangalore.\nhttps://rephonic.com/podcasts/the-history-of-bangalore",
    "type": "message"
  },
  {
    "timestamp": "2024-07-04T18:29:00",
    "timestamp_text": "04/07/24, 18:29",
    "sender": "Self Community",
    "message": "So folks,\nLet's hear your fav history facts please?",
    "type": "message"
  },
  {
    "timestamp": "2024-07-04T18:51:00",
    "timestamp_text": "04/07/24, 18:51",
    "sender": "Self Community",
    "message": "https://www.instagram.com/reel/C9ACFW-MwGf/?igsh=dWViOHR5bndhbTJm",
    "type": "message"
  },
  {
    "timestamp": "2024-07-04T18:52:00",
    "timestamp_text": "04/07/24, 18:52",
    "sender": "Self Community",
    "message": "Have any of you seen a Veera Gallu?",
    "type": "message"
  },
  {
    "timestamp": "2024-07-07T15:00:00",
    "timestamp_text": "07/07/24, 15:00",
    "sender": "Self Community",
    "message": "POLL:\nHow familiar are you with the Great Trigonometrical Survey?\nOPTION: Know a lot about it (0 votes)\nOPTION: Some knowledge (1 vote)\nOPTION: Heard of it (0 votes)\nOPTION: The what? (2 votes)\n",
    "type": "message"
  },
  {
    "timestamp": "2024-07-07T15:14:00",
    "timestamp_text": "07/07/24, 15:14",
    "sender": null,
    "message": "You added Soozy",
    "type": "system"
  },
  {
    "timestamp": "2024-07-07T15:22:00",
    "timestamp_text": "07/07/24, 15:22",
    "sender": null,
    "message": "You added Swapnil Dhanawade Soozy",
    "type": "system"
  },
  {
    "timestamp": "2024-07-08T11:17:00",
    "timestamp_text": "08/07/24, 11:17",
    "sender": "Self Community",
    "message": "Initiated in 1802, The Great Trigonometrical Survey (GTS) was a monumental project undertaken by the Survey of India.",
    "type": "message"
  },
  {
    "timestamp": "2024-07-08T11:18:00",
    "timestamp_text": "08/07/24, 11:18",
    "sender": "Self Community",
    "message": "Its primary objective was to measure the entire Indian subcontinent with scientific precision.",
    "type": "message"
  },
  {
    "timestamp": "2024-07-08T11:18:00",
    "timestamp_text": "08/07/24, 11:18",
    "sender": "Self Community",
    "message": "This survey played a critical role in the development of modern cartography, geodesy, and contributed significantly to the understanding of the Earth's shape and dimensions.",
    "type": "message"
  },
  {
    "timestamp": "2024-07-08T11:19:00",
    "timestamp_text": "08/07/24, 11:19",
    "sender": "Self Community",
    "message": "One of the countless outcomes was the naming of Mt. Everest and the measurement of its height leading to its recognition as the highest peak on the planet",
    "type": "message"
  },
  {
    "timestamp": "2024-07-08T11:19:00",
    "timestamp_text": "08/07/24, 11:19",
    "sender": "Self Community",
    "message": "Before this, it was known as Peak XV",
    "type": "message"
  },
  {
    "timestamp": "2024-07-08T11:20:00",
    "timestamp_text": "08/07/24, 11:20",
    "sender": "Self Community",
    "message": "Living in Bangalore, some of you may recognise that the VC firm Sequoia India chose to rename itself as Peak XV partners. This is the origin of the name",
    "type": "message"
  },
  {
    "timestamp": "2024-07-08T11:21:00",
    "timestamp_text": "08/07/24, 11:21",
    "sender": "Self Community",
    "message": "But the reason I brought up GTS is even closer to home",
    "type": "message"
  },
  {
    "timestamp": "2024-07-08T11:26:00",
    "timestamp_text": "08/07/24, 11:26",
    "sender": "Self Community",
    "message": "GTS required the establishment of baselines at various locations throughout the country",
    "type": "message"
  },
  {
    "timestamp": "2024-07-08T11:27:00",
    "timestamp_text": "08/07/24, 11:27",
    "sender": "Self Community",
    "message": "A baseline is a permanently fixed reference survey station or point, having known elevation with respect to mean sea level",
    "type": "message"
  },
  {
    "timestamp": "2024-07-08T11:32:00",
    "timestamp_text": "08/07/24, 11:32",
    "sender": "Self Community",
    "message": "Te first baseline was drawn between KR Puram and Agara but it was then abandoned due to a technical error",
    "type": "message"
  },
  {
    "timestamp": "2024-07-08T11:36:00",
    "timestamp_text": "08/07/24, 11:36",
    "sender": "Self Community",
    "message": "Later, a new baseline was established in Bangalore <This message was edited>",
    "type": "message"
  },
  {
    "timestamp": "2024-07-08T11:37:00",
    "timestamp_text": "08/07/24, 11:37",
    "sender": "Self Community",
    "message": "This also included 9 benchmark points and observatories",
    "type": "message"
  },
  {
    "timestamp": "2024-07-08T11:37:00",
    "timestamp_text": "08/07/24, 11:37",
    "sender": "Self Community",
    "message": "4 survive",
    "type": "message"
  },
  {
    "timestamp": "2024-07-08T11:37:00",
    "timestamp_text": "08/07/24, 11:37",
    "sender": "Self Community",
    "message": "Till last month, this number was 5",
    "type": "message"
  },
  {
    "timestamp": "2024-07-08T11:40:00",
    "timestamp_text": "08/07/24, 11:40",
    "sender": "Self Community",
    "message": "An observatory stood off Hennur-Bagalur Road",
    "type": "message"
  },
  {
    "timestamp": "2024-07-08T11:40:00",
    "timestamp_text": "08/07/24, 11:40",
    "sender": "Self Community",
    "message": "It was in a very dilapidated condition",
    "type": "message"
  },
  {
    "timestamp": "2024-07-08T11:40:00",
    "timestamp_text": "08/07/24, 11:40",
    "sender": "Self Community",
    "message": "Then INTACH restored in 2021",
    "type": "message"
  },
  {
    "timestamp": "2024-07-08T11:41:00",
    "timestamp_text": "08/07/24, 11:41",
    "sender": "Self Community",
    "message": "On June 4, this year, a land grabber demolished the entire structure overnight",
    "type": "message"
  },
  {
    "timestamp": "2024-07-08T11:43:00",
    "timestamp_text": "08/07/24, 11:43",
    "sender": "Self Community",
    "message": "<Media omitted>",
    "type": "message"
  },
  {
    "timestamp": "2024-07-08T11:43:00",
    "timestamp_text": "08/07/24, 11:43",
    "sender": "Self Community",
    "message": "<Media omitted>",
    "type": "message"
  },
  {
    "timestamp": "2024-07-08T11:44:00",
    "timestamp_text": "08/07/24, 11:44",
    "sender": "Self Community",
    "message": "<Media omitted>",
    "type": "message"
  },
  {
    "timestamp": "2024-07-08T11:44:00",
    "timestamp_text": "08/07/24, 11:44",
    "sender": "Self Community",
    "message": "<Media omitted>",
    "type": "message"
  },
  {
    "timestamp": "2024-07-08T11:45:00",
    "timestamp_text": "08/07/24, 11:45",
    "sender": "Self Community",
    "message": "<the end>",
    "type": "message"
  },
  {
    "timestamp": "2024-07-08T11:58:00",
    "timestamp_text": "08/07/24, 11:58",
    "sender": "Anusha YD",
    "message": "Wow! Thanks for sharing this..",
    "type": "message"
  },
  {
    "timestamp": "2024-07-08T13:36:00",
    "timestamp_text": "08/07/24, 13:36",
    "sender": "Vani Subramaniam Heritage Walk",
    "message": "Really interesting, thank you for sharing",
    "type": "message"
  },
  {
    "timestamp": "2024-07-08T14:13:00",
    "timestamp_text": "08/07/24, 14:13",
    "sender": "Self Community",
    "message": "<Media omitted>",
    "type": "message"
  },
  {
    "timestamp": "2024-07-08T14:13:00",
    "timestamp_text": "08/07/24, 14:13",
    "sender": "Self Community",
    "message": "A reminder, my next walk is on Saturday.",
    "type": "message"
  },
  {
    "timestamp": "2024-07-08T14:13:00",
    "timestamp_text": "08/07/24, 14:13",
    "sender": "Self Community",
    "message": "Please join if you haven't participated in this walk",
    "type": "message"
  },
  {
    "timestamp": "2024-07-08T14:13:00",
    "timestamp_text": "08/07/24, 14:13",
    "sender": "Self Community",
    "message": "And also please spread the word",
    "type": "message"
  },
  {
    "timestamp": "2024-07-08T14:14:00",
    "timestamp_text": "08/07/24, 14:14",
    "sender": "Self Community",
    "message": "Reg link: https://dhvo.short.gy/HW3",
    "type": "message"
  },
  {
    "timestamp": "2024-07-10T11:55:00",
    "timestamp_text": "10/07/24, 11:55",
    "sender": "Self Community",
    "message": "POLL:\nWhich was Bangalore's 1st railway station opened in 1864?\nOPTION: KSR (1 vote)\nOPTION: Cantt (2 votes)\nOPTION: Yeshwantpur (1 vote)\n",
    "type": "message"
  },
  {
    "timestamp": "2024-07-12T11:40:00",
    "timestamp_text": "12/07/24, 11:40",
    "sender": null,
    "message": "Sudhir Kumar B Aeries requested to join.",
    "type": "system"
  },
  {
    "timestamp": "2024-07-12T17:15:00",
    "timestamp_text": "12/07/24, 17:15",
    "sender": null,
    "message": "Sudhir Kumar B Aeries joined from the community",
    "type": "system"
  },
  {
    "timestamp": "2024-07-13T13:03:00",
    "timestamp_text": "13/07/24, 13:03",
    "sender": null,
    "message": "Rohith Heritage Walk requested to join.",
    "type": "system"
  },
  {
    "timestamp": "2024-07-13T13:05:00",
    "timestamp_text": "13/07/24, 13:05",
    "sender": null,
    "message": "Rohith Heritage Walk joined using a group link.",
    "type": "system"
  },
  {
    "timestamp": "2024-07-13T13:22:00",
    "timestamp_text": "13/07/24, 13:22",
    "sender": null,
    "message": "Karan Lakhwani Heritage Walk requested to join.",
    "type": "system"
  },
  {
    "timestamp": "2024-07-13T13:23:00",
    "timestamp_text": "13/07/24, 13:23",
    "sender": null,
    "message": "Karan Lakhwani Heritage Walk joined using a group link.",
    "type": "system"
  },
  {
    "timestamp": "2024-07-13T13:46:00",
    "timestamp_text": "13/07/24, 13:46",
    "sender": null,
    "message": "You added Biswajit Das Bengaluritage and Sandhya Rani Sr. TA CommerceIQ",
    "type": "system"
  },
  {
    "timestamp": "2024-07-13T13:48:00",
    "timestamp_text": "13/07/24, 13:48",
    "sender": "Suyash",
    "message": "Folks, I'm so sorry. I completely forgot to share about this",
    "type": "message"
  },
  {
    "timestamp": "2024-07-13T13:48:00",
    "timestamp_text": "13/07/24, 13:48",
    "sender": "Suyash",
    "message": "@⁨Aadhya Shah Bengaluritage⁩ @⁨Laksha YD⁩ \nYou got this absolutely right",
    "type": "message"
  },
  {
    "timestamp": "2024-07-13T13:49:00",
    "timestamp_text": "13/07/24, 13:49",
    "sender": "Suyash",
    "message": "The oldest railway station of Bangalore is the Bangalore Cantt station",
    "type": "message"
  },
  {
    "timestamp": "2024-07-13T13:49:00",
    "timestamp_text": "13/07/24, 13:49",
    "sender": "Suyash",
    "message": "It opened in 1864",
    "type": "message"
  },
  {
    "timestamp": "2024-07-13T13:50:00",
    "timestamp_text": "13/07/24, 13:50",
    "sender": "Suyash",
    "message": "To run goods transportation trains between Chennai and Madras",
    "type": "message"
  },
  {
    "timestamp": "2024-07-13T13:51:00",
    "timestamp_text": "13/07/24, 13:51",
    "sender": "Suyash",
    "message": "This was just 11 years after the first railway line was opened between Thane and Bombay in 1853",
    "type": "message"
  },
  {
    "timestamp": "2024-07-13T13:52:00",
    "timestamp_text": "13/07/24, 13:52",
    "sender": "Suyash",
    "message": "The line specifically ran between Bangalore Cantt station and Jolarpettai station in Madras",
    "type": "message"
  },
  {
    "timestamp": "2024-07-13T13:54:00",
    "timestamp_text": "13/07/24, 13:54",
    "sender": "Suyash",
    "message": "This is a pretty good article on the station's history: https://indianexpress.com/article/cities/bangalore/bangalore-cantonment-railway-station-military-hub-british-hub-9352856/",
    "type": "message"
  },
  {
    "timestamp": "2024-07-13T13:55:00",
    "timestamp_text": "13/07/24, 13:55",
    "sender": "Dinesh Camera Traveller Heritage Walk",
    "message": "love these, we need more 🤓",
    "type": "message"
  },
  {
    "timestamp": "2024-07-13T13:56:00",
    "timestamp_text": "13/07/24, 13:56",
    "sender": "Suyash",
    "message": "I also want to welcome new community members",
    "type": "message"
  },
  {
    "timestamp": "2024-07-13T13:57:00",
    "timestamp_text": "13/07/24, 13:57",
    "sender": "Suyash",
    "message": "@⁨Biswajit Das Bengaluritage⁩ @⁨Sudhir Kumar B Aeries⁩ @⁨Karan Lakhwani Heritage Walk⁩ @⁨Rohith Heritage Walk⁩ @⁨Sandhya Rani Sr. TA CommerceIQ⁩ Welcome to Bengaluritage",
    "type": "message"
  },
  {
    "timestamp": "2024-07-13T13:58:00",
    "timestamp_text": "13/07/24, 13:58",
    "sender": "Suyash",
    "message": "Please do share a bit about yourself, how long you've lived in Namma Bengaluru and if you have any fun fact or memory about the city that you'd like to share <This message was edited>",
    "type": "message"
  },
  {
    "timestamp": "2024-07-13T14:46:00",
    "timestamp_text": "13/07/24, 14:46",
    "sender": "Suyash",
    "message": "<Media omitted>",
    "type": "message"
  },
  {
    "timestamp": "2024-07-13T14:47:00",
    "timestamp_text": "13/07/24, 14:47",
    "sender": "Suyash",
    "message": "Sharing in case this is of interest to anyone",
    "type": "message"
  },
  {
    "timestamp": "2024-07-13T14:54:00",
    "timestamp_text": "13/07/24, 14:54",
    "sender": "Sandhya Rani Sr. TA CommerceIQ",
    "message": "Thanks Suyash.\n I live in Bengaluru since 2013.\nI came to Bengaluru for my studies but it’s never like new for me, bcz most of my summers are used to be here since I have a lot of my close relatives and also it’s just 100km from native. <This message was edited>",
    "type": "message"
  },
  {
    "timestamp": "2024-07-13T14:55:00",
    "timestamp_text": "13/07/24, 14:55",
    "sender": "Suyash",
    "message": "What has been your fav place in the city this entire time?",
    "type": "message"
  },
  {
    "timestamp": "2024-07-13T14:56:00",
    "timestamp_text": "13/07/24, 14:56",
    "sender": "Sandhya Rani Sr. TA CommerceIQ",
    "message": "Malleshwaram",
    "type": "message"
  },
  {
    "timestamp": "2024-07-13T14:56:00",
    "timestamp_text": "13/07/24, 14:56",
    "sender": "Sandhya Rani Sr. TA CommerceIQ",
    "message": "For old BLR vibes and MG road for futuristic vibes",
    "type": "message"
  },
  {
    "timestamp": "2024-07-13T15:00:00",
    "timestamp_text": "13/07/24, 15:00",
    "sender": "Suyash",
    "message": "Any places in particular?",
    "type": "message"
  },
  {
    "timestamp": "2024-07-13T15:02:00",
    "timestamp_text": "13/07/24, 15:02",
    "sender": "Suyash",
    "message": "Timing is 1000 to 1800",
    "type": "message"
  },
  {
    "timestamp": "2024-07-13T15:03:00",
    "timestamp_text": "13/07/24, 15:03",
    "sender": "Suyash",
    "message": "I may go tomorrow in case anyone wants to join",
    "type": "message"
  },
  {
    "timestamp": "2024-07-13T15:04:00",
    "timestamp_text": "13/07/24, 15:04",
    "sender": "Sandhya Rani Sr. TA CommerceIQ",
    "message": "Shri Kadu Mallikarjuna Swamy Temple and surroundings In Malleshwaram (specifically if you are a temple person)",
    "type": "message"
  },
  {
    "timestamp": "2024-07-13T15:05:00",
    "timestamp_text": "13/07/24, 15:05",
    "sender": "Suyash",
    "message": "That's a pretty significant temple heritage wise",
    "type": "message"
  },
  {
    "timestamp": "2024-07-13T15:06:00",
    "timestamp_text": "13/07/24, 15:06",
    "sender": "Suyash",
    "message": "Do you know anything about it Sandhya?",
    "type": "message"
  },
  {
    "timestamp": "2024-07-13T15:09:00",
    "timestamp_text": "13/07/24, 15:09",
    "sender": "Sandhya Rani Sr. TA CommerceIQ",
    "message": "Not much bout it. \nI heard there is a surang marg there.",
    "type": "message"
  },
  {
    "timestamp": "2024-07-13T15:18:00",
    "timestamp_text": "13/07/24, 15:18",
    "sender": "Suyash",
    "message": "That I didn't know. Nice thanks. Shall research",
    "type": "message"
  },
  {
    "timestamp": "2024-07-13T15:18:00",
    "timestamp_text": "13/07/24, 15:18",
    "sender": "Suyash",
    "message": "This temple is from 17th century",
    "type": "message"
  },
  {
    "timestamp": "2024-07-13T15:19:00",
    "timestamp_text": "13/07/24, 15:19",
    "sender": "Suyash",
    "message": "Malleswaram gets its name from the temple <This message was edited>",
    "type": "message"
  },
  {
    "timestamp": "2024-07-13T15:21:00",
    "timestamp_text": "13/07/24, 15:21",
    "sender": "Suyash",
    "message": "It was built by Ekoji who ruled Bangalore",
    "type": "message"
  },
  {
    "timestamp": "2024-07-13T15:24:00",
    "timestamp_text": "13/07/24, 15:24",
    "sender": "Suyash",
    "message": "Late 1670s-1689",
    "type": "message"
  },
  {
    "timestamp": "2024-07-13T15:25:00",
    "timestamp_text": "13/07/24, 15:25",
    "sender": "Suyash",
    "message": "Ekoji was the younger half-brother of Chatrapati Shivaji",
    "type": "message"
  },
  {
    "timestamp": "2024-07-13T15:30:00",
    "timestamp_text": "13/07/24, 15:30",
    "sender": "Suyash",
    "message": "Their father Shahaji conquered Bangalore for the Bijapur Sultan",
    "type": "message"
  },
  {
    "timestamp": "2024-07-13T15:30:00",
    "timestamp_text": "13/07/24, 15:30",
    "sender": "Suyash",
    "message": "fin.",
    "type": "message"
  },
  {
    "timestamp": "2024-07-13T15:54:00",
    "timestamp_text": "13/07/24, 15:54",
    "sender": "Sandhya Rani Sr. TA CommerceIQ",
    "message": "So much insights 👏👍",
    "type": "message"
  },
  {
    "timestamp": "2024-07-13T18:04:00",
    "timestamp_text": "13/07/24, 18:04",
    "sender": "Kiranmayi Kalepalli Senior Recruiter Capgemini",
    "message": "Shri Kadu Mallikarjuna Swamy Temple\n098450 75961\nhttps://g.co/kgs/upJnwBJ\n\nTickets\nhttps://g.co/kgs/kijT2nr\n\nPhotos\nhttps://g.co/kgs/76f8n9T",
    "type": "message"
  },
  {
    "timestamp": "2024-07-13T18:05:00",
    "timestamp_text": "13/07/24, 18:05",
    "sender": "Kiranmayi Kalepalli Senior Recruiter Capgemini",
    "message": "The word 'Kadu' means forest, here referring to the thick greenery all around the temple.[1]",
    "type": "message"
  },
  {
    "timestamp": "2024-07-13T18:09:00",
    "timestamp_text": "13/07/24, 18:09",
    "sender": null,
    "message": "Vinutha requested to join.",
    "type": "system"
  },
  {
    "timestamp": "2024-07-13T18:11:00",
    "timestamp_text": "13/07/24, 18:11",
    "sender": "Kiranmayi Kalepalli Senior Recruiter Capgemini",
    "message": "Malleswaram has many ancient Hindu temples. In fact, the area is named after one. I highly recommend visiting three major temples, the Kadu Malleshwara temple which is adjacent to the Nandi Theertha temple. The other temple to visit is the Gangamma Devi temple.",
    "type": "message"
  },
  {
    "timestamp": "2024-07-13T18:11:00",
    "timestamp_text": "13/07/24, 18:11",
    "sender": "Kiranmayi Kalepalli Senior Recruiter Capgemini",
    "message": "Shared few insights which I know",
    "type": "message"
  },
  {
    "timestamp": "2024-07-14T02:42:00",
    "timestamp_text": "14/07/24, 02:42",
    "sender": null,
    "message": "Vinutha joined from the community",
    "type": "system"
  },
  {
    "timestamp": "2024-07-14T02:42:00",
    "timestamp_text": "14/07/24, 02:42",
    "sender": "Suyash",
    "message": "https://www.instagram.com/reel/C7W2_xNJGs2/?igsh=MTZuYjg2N2twMzdhbw==",
    "type": "message"
  },
  {
    "timestamp": "2024-07-15T15:42:00",
    "timestamp_text": "15/07/24, 15:42",
    "sender": "Suyash",
    "message": "Folks, planning to do the MG Road-Brigade Group walk again this Saturday if I get sufficient interest.",
    "type": "message"
  },
  {
    "timestamp": "2024-07-15T16:01:00",
    "timestamp_text": "15/07/24, 16:01",
    "sender": "Suyash",
    "message": "https://www.linkedin.com/posts/suyash-kumar-marketing_bengaluritage-heritagewalk-bengaluru-activity-7218561806456250368-0A6m?utm_source=share&utm_medium=member_android",
    "type": "message"
  },
  {
    "timestamp": "2024-07-18T11:19:00",
    "timestamp_text": "18/07/24, 11:19",
    "sender": "Suyash",
    "message": "https://www.instagram.com/p/C9eWPZ0se2g/?igsh=MTNjOGIxdTIzb2V1MQ==",
    "type": "message"
  },
  {
    "timestamp": "2024-07-18T15:28:00",
    "timestamp_text": "18/07/24, 15:28",
    "sender": "Suyash",
    "message": "<Media omitted>",
    "type": "message"
  },
  {
    "timestamp": "2024-07-18T15:28:00",
    "timestamp_text": "18/07/24, 15:28",
    "sender": "Suyash",
    "message": "https://www.tuckdbpostcards.org/items/58471-south-parade/picture/1",
    "type": "message"
  },
  {
    "timestamp": "2024-07-18T20:53:00",
    "timestamp_text": "18/07/24, 20:53",
    "sender": null,
    "message": "Arundhati Raaj Bengaluritage requested to join.",
    "type": "system"
  },
  {
    "timestamp": "2024-07-18T21:06:00",
    "timestamp_text": "18/07/24, 21:06",
    "sender": null,
    "message": "Lt Cdr. Jeeth Jacob Thomas requested to join.",
    "type": "system"
  },
  {
    "timestamp": "2024-07-19T10:54:00",
    "timestamp_text": "19/07/24, 10:54",
    "sender": "Suyash",
    "message": "https://bangaloremirror.indiatimes.com/bangalore-my-city-my-home/articleshow/21442617.cms",
    "type": "message"
  },
  {
    "timestamp": "2024-07-19T10:54:00",
    "timestamp_text": "19/07/24, 10:54",
    "sender": "Suyash",
    "message": "Really nice personal memories of a Bangalore old-timer from the area we explore in our walk <This message was edited>",
    "type": "message"
  },
  {
    "timestamp": "2024-07-21T21:16:00",
    "timestamp_text": "21/07/24, 21:16",
    "sender": null,
    "message": "Ankur Kayesth Masai requested to join.",
    "type": "system"
  },
  {
    "timestamp": "2024-07-23T17:04:00",
    "timestamp_text": "23/07/24, 17:04",
    "sender": null,
    "message": "Ankur Kayesth Masai joined using a group link.",
    "type": "system"
  },
  {
    "timestamp": "2024-07-23T17:04:00",
    "timestamp_text": "23/07/24, 17:04",
    "sender": null,
    "message": "Lt Cdr. Jeeth Jacob Thomas joined from the community",
    "type": "system"
  },
  {
    "timestamp": "2024-07-23T17:04:00",
    "timestamp_text": "23/07/24, 17:04",
    "sender": null,
    "message": "Arundhati Raaj Bengaluritage joined from the community",
    "type": "system"
  },
  {
    "timestamp": "2024-07-23T17:10:00",
    "timestamp_text": "23/07/24, 17:10",
    "sender": null,
    "message": "You added Spoorthi Hegde Bengaluritage",
    "type": "system"
  },
  {
    "timestamp": "2024-07-23T17:12:00",
    "timestamp_text": "23/07/24, 17:12",
    "sender": null,
    "message": "Anand Murthy Bengaluritage joined using your invite",
    "type": "system"
  },
  {
    "timestamp": "2024-07-23T17:13:00",
    "timestamp_text": "23/07/24, 17:13",
    "sender": "Suyash",
    "message": "Really awesome recent video on History of Bengaluru \n\nhttps://youtu.be/8jQ43L4-_TA?si=DYPanDolL_HiuQrh",
    "type": "message"
  },
  {
    "timestamp": "2024-07-23T17:14:00",
    "timestamp_text": "23/07/24, 17:14",
    "sender": "Anand Murthy Bengaluritage",
    "message": "Hi Anand here and I am a locality born and bought in bangalore 😊 happy to join this group! #Bengaluru #LocalBoy",
    "type": "message"
  },
  {
    "timestamp": "2024-07-23T17:15:00",
    "timestamp_text": "23/07/24, 17:15",
    "sender": "Suyash",
    "message": "Welcome Anand!",
    "type": "message"
  },
  {
    "timestamp": "2024-07-23T17:15:00",
    "timestamp_text": "23/07/24, 17:15",
    "sender": "Anand Murthy Bengaluritage",
    "message": "Thanks",
    "type": "message"
  },
  {
    "timestamp": "2024-07-23T17:15:00",
    "timestamp_text": "23/07/24, 17:15",
    "sender": "Suyash",
    "message": "Any favourite history fact about Bangalore?",
    "type": "message"
  },
  {
    "timestamp": "2024-07-23T17:16:00",
    "timestamp_text": "23/07/24, 17:16",
    "sender": "Suyash",
    "message": "Or any fav history fact in general too",
    "type": "message"
  },
  {
    "timestamp": "2024-07-23T17:23:00",
    "timestamp_text": "23/07/24, 17:23",
    "sender": "Anand Murthy Bengaluritage",
    "message": "There are a lot of nostalgia moments starting from childhood favorite rides such as the double decker bus ride, MG road, and weather greenery all the place theaters since I am a movie enthusiast with a big list",
    "type": "message"
  },
  {
    "timestamp": "2024-07-23T17:29:00",
    "timestamp_text": "23/07/24, 17:29",
    "sender": "Suyash",
    "message": "Please do share stories as and when time permits",
    "type": "message"
  },
  {
    "timestamp": "2024-07-23T17:29:00",
    "timestamp_text": "23/07/24, 17:29",
    "sender": "Suyash",
    "message": "🙏🏻",
    "type": "message"
  },
  {
    "timestamp": "2024-07-23T17:30:00",
    "timestamp_text": "23/07/24, 17:30",
    "sender": "Suyash",
    "message": "Which parts of Bangalore have your resided in @⁨Anand Murthy Bengaluritage⁩",
    "type": "message"
  },
  {
    "timestamp": "2024-07-23T17:31:00",
    "timestamp_text": "23/07/24, 17:31",
    "sender": "Arundhati Raaj Bengaluritage",
    "message": "Big and warm hello to everyone in here! \n\nI am Arundhati; I am quite new to Bengaluru and I am exploring ways to connect with this new city and establish newer human connections. I love walks -- be it of heritage, food, poetry, botany -- it is my way to embrace the hollowness of existence. Though an extremely lazy texter,  and selectively introverted, I am as curious as a cat when it comes to trying new community engagements.",
    "type": "message"
  },
  {
    "timestamp": "2024-07-23T17:32:00",
    "timestamp_text": "23/07/24, 17:32",
    "sender": "Suyash",
    "message": "Thank you for joining us Arundhati",
    "type": "message"
  },
  {
    "timestamp": "2024-07-23T17:32:00",
    "timestamp_text": "23/07/24, 17:32",
    "sender": "Arundhati Raaj Bengaluritage",
    "message": "My pleasure :)",
    "type": "message"
  },
  {
    "timestamp": "2024-07-23T17:33:00",
    "timestamp_text": "23/07/24, 17:33",
    "sender": "Suyash",
    "message": "What's your hometown Arundhati?",
    "type": "message"
  },
  {
    "timestamp": "2024-07-23T17:35:00",
    "timestamp_text": "23/07/24, 17:35",
    "sender": "Arundhati Raaj Bengaluritage",
    "message": "I am a Malayali from Malabar. But my family lives in Vadodara, Gujarat. I was living in Delhi for the past 5-6 years. So, I am in an eternal dilemma about where exactly is my home and hometown.",
    "type": "message"
  },
  {
    "timestamp": "2024-07-23T17:35:00",
    "timestamp_text": "23/07/24, 17:35",
    "sender": "Anand Murthy Bengaluritage",
    "message": "I stay at ulsoor",
    "type": "message"
  },
  {
    "timestamp": "2024-07-23T17:35:00",
    "timestamp_text": "23/07/24, 17:35",
    "sender": "Suyash",
    "message": "I hear you. I have found myself in similar predicament.",
    "type": "message"
  },
  {
    "timestamp": "2024-07-23T17:36:00",
    "timestamp_text": "23/07/24, 17:36",
    "sender": "Suyash",
    "message": "Ah nice. Ever got the chance and permission to visit the Madras Sappers museum there?",
    "type": "message"
  },
  {
    "timestamp": "2024-07-23T17:37:00",
    "timestamp_text": "23/07/24, 17:37",
    "sender": "Arundhati Raaj Bengaluritage",
    "message": "One small thing, maybe. \n\nIt is originally called/known as 'Malleshwara' (not Malleshwaram), after Lord Malleswara. I heard that old Bengaluru folks still conservatively prefer Malleswara over Malleswaram.",
    "type": "message"
  },
  {
    "timestamp": "2024-07-23T17:38:00",
    "timestamp_text": "23/07/24, 17:38",
    "sender": "Suyash",
    "message": "Yes, we actually discussed this very thing sometime back here in the group",
    "type": "message"
  },
  {
    "timestamp": "2024-07-23T17:38:00",
    "timestamp_text": "23/07/24, 17:38",
    "sender": "Arundhati Raaj Bengaluritage",
    "message": "Ok!",
    "type": "message"
  },
  {
    "timestamp": "2024-07-23T17:39:00",
    "timestamp_text": "23/07/24, 17:39",
    "sender": "Suyash",
    "message": "It's named after the Kadu Malleswara temple",
    "type": "message"
  },
  {
    "timestamp": "2024-07-23T17:39:00",
    "timestamp_text": "23/07/24, 17:39",
    "sender": "Arundhati Raaj Bengaluritage",
    "message": "Yes.",
    "type": "message"
  },
  {
    "timestamp": "2024-07-23T17:40:00",
    "timestamp_text": "23/07/24, 17:40",
    "sender": "Suyash",
    "message": "It was built in the 17th century by Venkoji, Shivaji's brother <This message was edited>",
    "type": "message"
  },
  {
    "timestamp": "2024-07-23T17:40:00",
    "timestamp_text": "23/07/24, 17:40",
    "sender": "Suyash",
    "message": "You should give it a visit. Share pics",
    "type": "message"
  },
  {
    "timestamp": "2024-07-23T17:41:00",
    "timestamp_text": "23/07/24, 17:41",
    "sender": "Suyash",
    "message": "Nooo way @⁨Anand Murthy Bengaluritage⁩ \nMan I so want to visit that museum",
    "type": "message"
  },
  {
    "timestamp": "2024-07-23T17:42:00",
    "timestamp_text": "23/07/24, 17:42",
    "sender": "Suyash",
    "message": "Do you know how one can apply for permission?",
    "type": "message"
  },
  {
    "timestamp": "2024-07-23T17:52:00",
    "timestamp_text": "23/07/24, 17:52",
    "sender": "Anand Murthy Bengaluritage",
    "message": "Sorry not pretty sure because I remember going in childhood with some army connects my family had....",
    "type": "message"
  },
  {
    "timestamp": "2024-07-23T17:52:00",
    "timestamp_text": "23/07/24, 17:52",
    "sender": "Anand Murthy Bengaluritage",
    "message": "Let me check and tell you.",
    "type": "message"
  },
  {
    "timestamp": "2024-07-23T17:53:00",
    "timestamp_text": "23/07/24, 17:53",
    "sender": "Suyash",
    "message": "Yeah, I gotta choose better parents 😅",
    "type": "message"
  },
  {
    "timestamp": "2024-07-23T17:53:00",
    "timestamp_text": "23/07/24, 17:53",
    "sender": "Suyash",
    "message": "Oh thank you 🙌🏼",
    "type": "message"
  },
  {
    "timestamp": "2024-07-23T17:56:00",
    "timestamp_text": "23/07/24, 17:56",
    "sender": "Aadhya Shah Bengaluritage",
    "message": "Piggybacking on this thread and introducing myself. Hi I am am Aadhya, joined this group several weeks back and forgot to introduce myself. I have lived a total of 5 years in Bangalore, originally from Vadodara (hence piggybacking in this thread). I live in Fraser town, but a few months ago was based out of shantinagar area. So I miss my proximity to cubbon park but excited to discover fraser town 🥲",
    "type": "message"
  },
  {
    "timestamp": "2024-07-23T17:58:00",
    "timestamp_text": "23/07/24, 17:58",
    "sender": null,
    "message": "Self Community: This message was deleted",
    "type": "system"
  },
  {
    "timestamp": "2024-07-23T17:59:00",
    "timestamp_text": "23/07/24, 17:59",
    "sender": "Suyash",
    "message": "So glad to have you with us",
    "type": "message"
  },
  {
    "timestamp": "2024-07-23T18:03:00",
    "timestamp_text": "23/07/24, 18:03",
    "sender": "Suyash",
    "message": "Those who'd like to learn more about this museum, read this article:\nhttps://www.deccanchronicle.com/nation/current-affairs/171119/meg-museum-treasuring-two-centuries-of-bravery.html",
    "type": "message"
  },
  {
    "timestamp": "2024-07-23T18:23:00",
    "timestamp_text": "23/07/24, 18:23",
    "sender": "Laksha YD",
    "message": "Piggy piggy backing cus I also forgot to introduce myself here. \n\nI'm laksha, born and raised in Bangalore. Grew up near kr puram and ITI (the factory) Colony so just have a lot of personal history here",
    "type": "message"
  },
  {
    "timestamp": "2024-07-23T19:20:00",
    "timestamp_text": "23/07/24, 19:20",
    "sender": "Suyash",
    "message": "Heyy Laksha",
    "type": "message"
  },
  {
    "timestamp": "2024-07-23T19:20:00",
    "timestamp_text": "23/07/24, 19:20",
    "sender": "Suyash",
    "message": "KR Puram, again pretty historic",
    "type": "message"
  },
  {
    "timestamp": "2024-07-26T12:36:00",
    "timestamp_text": "26/07/24, 12:36",
    "sender": "Suyash",
    "message": "POLL:\nAre you familiar with historical inscription stones found all over the city?\nOPTION: Yes, I've also seen 1 (1 vote)\nOPTION: Yes, but never seen 1 (3 votes)\nOPTION: Vaguely familar (0 votes)\nOPTION: No idea (8 votes)\n",
    "type": "message"
  },
  {
    "timestamp": "2024-07-26T14:12:00",
    "timestamp_text": "26/07/24, 14:12",
    "sender": "Anand Murthy Bengaluritage",
    "message": "R u talking about the boundaries set by Kempagowda",
    "type": "message"
  },
  {
    "timestamp": "2024-07-27T06:10:00",
    "timestamp_text": "27/07/24, 06:10",
    "sender": "Suyash",
    "message": "No Anand.\nI'm talking about hero stones, etc.",
    "type": "message"
  },
  {
    "timestamp": "2024-08-02T20:21:00",
    "timestamp_text": "02/08/24, 20:21",
    "sender": "Suyash",
    "message": "https://theprint.in/opinion/how-did-taxes-work-in-medieval-india-chola-subjects-struggled-just-like-todays-middle-class/2200746/?fbclid=PAZXh0bgNhZW0CMTEAAaaChxz9l_1M08kzTnX6H2TxXEM_AsoQeY6gLtjuM4u_kBU3E6IifaJh8fk_aem_ZVbtxUSGMysvtjre8pe7Ug",
    "type": "message"
  },
  {
    "timestamp": "2024-08-02T20:58:00",
    "timestamp_text": "02/08/24, 20:58",
    "sender": "Suyash",
    "message": "<Media omitted>",
    "type": "message"
  },
  {
    "timestamp": "2024-08-02T20:59:00",
    "timestamp_text": "02/08/24, 20:59",
    "sender": "Suyash",
    "message": "Registration link: https://map-india.org/map-events/lives-loves-and-legacies-getting-to-know-the-mughals/",
    "type": "message"
  },
  {
    "timestamp": "2024-08-02T21:47:00",
    "timestamp_text": "02/08/24, 21:47",
    "sender": "Anusha YD",
    "message": "Thanks for sharing! Is it a book reading gathering?",
    "type": "message"
  },
  {
    "timestamp": "2024-08-02T22:10:00",
    "timestamp_text": "02/08/24, 22:10",
    "sender": null,
    "message": "Self Community: This message was deleted",
    "type": "system"
  },
  {
    "timestamp": "2024-08-02T22:10:00",
    "timestamp_text": "02/08/24, 22:10",
    "sender": "Suyash",
    "message": "I think it's a discussion and book launch",
    "type": "message"
  },
  {
    "timestamp": "2024-08-04T19:36:00",
    "timestamp_text": "04/08/24, 19:36",
    "sender": "Suyash",
    "message": "<Media omitted>",
    "type": "message"
  },
  {
    "timestamp": "2024-08-04T19:36:00",
    "timestamp_text": "04/08/24, 19:36",
    "sender": "Suyash",
    "message": "Just arrived",
    "type": "message"
  },
  {
    "timestamp": "2024-08-04T19:37:00",
    "timestamp_text": "04/08/24, 19:37",
    "sender": "Suyash",
    "message": "<Media omitted>",
    "type": "message"
  },
  {
    "timestamp": "2024-08-04T19:37:00",
    "timestamp_text": "04/08/24, 19:37",
    "sender": "Suyash",
    "message": "Btw, @⁨Ankur Kayesth Masai⁩, I and another friend went to Nijagal Betta today for a hike",
    "type": "message"
  },
  {
    "timestamp": "2024-08-04T19:37:00",
    "timestamp_text": "04/08/24, 19:37",
    "sender": "Suyash",
    "message": "Really cool place",
    "type": "message"
  },
  {
    "timestamp": "2024-08-04T19:38:00",
    "timestamp_text": "04/08/24, 19:38",
    "sender": "Suyash",
    "message": "<Media omitted>",
    "type": "message"
  },
  {
    "timestamp": "2024-08-04T19:38:00",
    "timestamp_text": "04/08/24, 19:38",
    "sender": "Suyash",
    "message": "<Media omitted>",
    "type": "message"
  },
  {
    "timestamp": "2024-08-04T19:38:00",
    "timestamp_text": "04/08/24, 19:38",
    "sender": "Suyash",
    "message": "There are these steps cut into the rock at many places which seemed quite old <This message was edited>",
    "type": "message"
  },
  {
    "timestamp": "2024-08-04T19:39:00",
    "timestamp_text": "04/08/24, 19:39",
    "sender": "Suyash",
    "message": "<Media omitted>",
    "type": "message"
  },
  {
    "timestamp": "2024-08-04T19:39:00",
    "timestamp_text": "04/08/24, 19:39",
    "sender": "Suyash",
    "message": "<Media omitted>",
    "type": "message"
  },
  {
    "timestamp": "2024-08-04T19:39:00",
    "timestamp_text": "04/08/24, 19:39",
    "sender": "Suyash",
    "message": "<Media omitted>",
    "type": "message"
  },
  {
    "timestamp": "2024-08-04T19:39:00",
    "timestamp_text": "04/08/24, 19:39",
    "sender": "Suyash",
    "message": "Would love to learn about these if anyone has any knowledge of the place",
    "type": "message"
  },
  {
    "timestamp": "2024-08-04T19:40:00",
    "timestamp_text": "04/08/24, 19:40",
    "sender": "Suyash",
    "message": "https://www.prekshaa.in/heroic-battle-nijagal-fort",
    "type": "message"
  },
  {
    "timestamp": "2024-08-04T19:40:00",
    "timestamp_text": "04/08/24, 19:40",
    "sender": "Suyash",
    "message": "This is 1 article I found about its history",
    "type": "message"
  },
  {
    "timestamp": "2024-08-04T20:23:00",
    "timestamp_text": "04/08/24, 20:23",
    "sender": "Suyash",
    "message": "Highly recommend the trek if you're looking for a short trek (40-60 mins). Medium difficulty. Distance from city is 60km",
    "type": "message"
  },
  {
    "timestamp": "2024-08-04T20:24:00",
    "timestamp_text": "04/08/24, 20:24",
    "sender": "Suyash",
    "message": "Much lesser if you stay towards IISc, RR Nagar, Yeshwantpur and beyond <This message was edited>",
    "type": "message"
  },
  {
    "timestamp": "2024-08-06T17:21:00",
    "timestamp_text": "06/08/24, 17:21",
    "sender": "Suyash",
    "message": "Details announced for Lalbagh flower show: \nhttps://www.oneindia.com/bengaluru/lalbagh-flower-show-2024-august-in-bengaluru-know-date-timings-ticket-price-parking-information-3898461.html",
    "type": "message"
  },
  {
    "timestamp": "2024-08-06T18:24:00",
    "timestamp_text": "06/08/24, 18:24",
    "sender": "Suyash",
    "message": "<Media omitted>",
    "type": "message"
  },
  {
    "timestamp": "2024-08-06T18:25:00",
    "timestamp_text": "06/08/24, 18:25",
    "sender": "Vani Subramaniam Heritage Walk",
    "message": "I'm legit considering setting up camp outside BIC at this point \nFascinating stuff constantly happening ther",
    "type": "message"
  },
  {
    "timestamp": "2024-08-06T18:36:00",
    "timestamp_text": "06/08/24, 18:36",
    "sender": "Anusha YD",
    "message": "Hahhaa.. hainaa! I can understand that feeling <This message was edited>",
    "type": "message"
  },
  {
    "timestamp": "2024-08-06T18:37:00",
    "timestamp_text": "06/08/24, 18:37",
    "sender": "Vani Subramaniam Heritage Walk",
    "message": "Yeah!\nI live so far away and see events there everyday and am like tent time",
    "type": "message"
  },
  {
    "timestamp": "2024-08-06T18:50:00",
    "timestamp_text": "06/08/24, 18:50",
    "sender": "Suyash",
    "message": "Hahaha",
    "type": "message"
  },
  {
    "timestamp": "2024-08-07T13:27:00",
    "timestamp_text": "07/08/24, 13:27",
    "sender": "Suyash",
    "message": "Terracotta pipeline from 6th century BCE uncovered in Keeladi, TN\n\nhttps://allthatsinteresting.com/keeladi-india-ancient-pipeline",
    "type": "message"
  },
  {
    "timestamp": "2024-08-07T14:13:00",
    "timestamp_text": "07/08/24, 14:13",
    "sender": null,
    "message": "Self Community: This message was deleted",
    "type": "system"
  },
  {
    "timestamp": "2024-08-07T14:13:00",
    "timestamp_text": "07/08/24, 14:13",
    "sender": "Suyash",
    "message": "<Media omitted>",
    "type": "message"
  },
  {
    "timestamp": "2024-08-07T14:19:00",
    "timestamp_text": "07/08/24, 14:19",
    "sender": "Vani Subramaniam Heritage Walk",
    "message": "How many to a team?",
    "type": "message"
  },
  {
    "timestamp": "2024-08-07T14:19:00",
    "timestamp_text": "07/08/24, 14:19",
    "sender": "Vani Subramaniam Heritage Walk",
    "message": "A friend and I might be interested",
    "type": "message"
  },
  {
    "timestamp": "2024-08-07T14:26:00",
    "timestamp_text": "07/08/24, 14:26",
    "sender": "Dinesh Camera Traveller Heritage Walk",
    "message": "I'm in! : )",
    "type": "message"
  },
  {
    "timestamp": "2024-08-07T14:27:00",
    "timestamp_text": "07/08/24, 14:27",
    "sender": "Suyash",
    "message": "They haven't specified. Let me register for 4 now.",
    "type": "message"
  },
  {
    "timestamp": "2024-08-07T14:27:00",
    "timestamp_text": "07/08/24, 14:27",
    "sender": "Suyash",
    "message": "@⁨Vani Subramaniam Heritage Walk⁩ Share your friend's mail id? I'll block all your calendars",
    "type": "message"
  },
  {
    "timestamp": "2024-08-07T14:28:00",
    "timestamp_text": "07/08/24, 14:28",
    "sender": "Vani Subramaniam Heritage Walk",
    "message": "Give me a bit?\nWill just confirm for sure and pass one or both our contacts",
    "type": "message"
  },
  {
    "timestamp": "2024-08-07T14:39:00",
    "timestamp_text": "07/08/24, 14:39",
    "sender": "Suyash",
    "message": "I have yours Vani",
    "type": "message"
  },
  {
    "timestamp": "2024-08-09T14:50:00",
    "timestamp_text": "09/08/24, 14:50",
    "sender": "Suyash",
    "message": "Hi folks",
    "type": "message"
  },
  {
    "timestamp": "2024-08-09T14:50:00",
    "timestamp_text": "09/08/24, 14:50",
    "sender": "Suyash",
    "message": "Doing the MG Road walk on Aug 17, Saturday",
    "type": "message"
  },
  {
    "timestamp": "2024-08-09T14:50:00",
    "timestamp_text": "09/08/24, 14:50",
    "sender": "Suyash",
    "message": "Please do share if you know anyone who will find this fun",
    "type": "message"
  },
  {
    "timestamp": "2024-08-09T14:51:00",
    "timestamp_text": "09/08/24, 14:51",
    "sender": "Suyash",
    "message": "<Media omitted>",
    "type": "message"
  },
  {
    "timestamp": "2024-08-09T14:51:00",
    "timestamp_text": "09/08/24, 14:51",
    "sender": "Suyash",
    "message": "https://dhvo.short.gy/BengaluritageMG",
    "type": "message"
  },
  {
    "timestamp": "2024-08-10T14:37:00",
    "timestamp_text": "10/08/24, 14:37",
    "sender": "Suyash",
    "message": "I haven't used an airport lounge in ages <This message was edited>",
    "type": "message"
  },
  {
    "timestamp": "2024-08-10T14:38:00",
    "timestamp_text": "10/08/24, 14:38",
    "sender": "Suyash",
    "message": "Probably 2019 last",
    "type": "message"
  },
  {
    "timestamp": "2024-08-10T14:38:00",
    "timestamp_text": "10/08/24, 14:38",
    "sender": "Suyash",
    "message": "But the few I've been to we're always so boring",
    "type": "message"
  },
  {
    "timestamp": "2024-08-10T14:38:00",
    "timestamp_text": "10/08/24, 14:38",
    "sender": "Suyash",
    "message": "But this is sounds so cool I really wanna go whenever I fly out next\nhttps://www.deccanherald.com/india/karnataka/bengaluru/new-lounge-at-kia-s-t2-celebrates-local-art-heritage-3143442",
    "type": "message"
  },
  {
    "timestamp": "2024-08-11T11:12:00",
    "timestamp_text": "11/08/24, 11:12",
    "sender": "Suyash",
    "message": "https://www.instagram.com/p/C-fa9c6tUVG/?igsh=bHprcHUxdDEwbmdl",
    "type": "message"
  },
  {
    "timestamp": "2024-08-11T11:57:00",
    "timestamp_text": "11/08/24, 11:57",
    "sender": "Suyash",
    "message": "<Media omitted>",
    "type": "message"
  },
  {
    "timestamp": "2024-08-11T11:59:00",
    "timestamp_text": "11/08/24, 11:59",
    "sender": "Vani Subramaniam Heritage Walk",
    "message": "Butter sponge",
    "type": "message"
  },
  {
    "timestamp": "2024-08-11T11:59:00",
    "timestamp_text": "11/08/24, 11:59",
    "sender": "Vani Subramaniam Heritage Walk",
    "message": "But not sure if it's still around",
    "type": "message"
  },
  {
    "timestamp": "2024-08-11T13:27:00",
    "timestamp_text": "11/08/24, 13:27",
    "sender": "Suyash",
    "message": "This one?\n\n\n\n https://www.google.com/search?client=ms-android-nothing-terr1-rso3&sca_esv=322f216abba8e01c&cs=1&hl=en-IN&output=search&kgmid=%2Fg%2F11sd0m_3c4&q=Butter%20Sponge%20Original%20(An%20unit%20of%20VB%20Bakery)&shndl=30&shem=lrnole%2Clsde%2Cvslcca&source=sh%2Fx%2Floc%2Fact%2Fm1%2F4&kgs=76a860bc2252703e",
    "type": "message"
  },
  {
    "timestamp": "2024-08-11T17:34:00",
    "timestamp_text": "11/08/24, 17:34",
    "sender": "Vani Subramaniam Heritage Walk",
    "message": "Yeppp",
    "type": "message"
  },
  {
    "timestamp": "2024-08-12T12:06:00",
    "timestamp_text": "12/08/24, 12:06",
    "sender": "Suyash",
    "message": "Folks, 4 of us are going for this. We still have a spot for 1 more person in case anyone's interested",
    "type": "message"
  },
  {
    "timestamp": "2024-08-12T23:39:00",
    "timestamp_text": "12/08/24, 23:39",
    "sender": "Suyash",
    "message": "<Media omitted>",
    "type": "message"
  },
  {
    "timestamp": "2024-08-12T23:39:00",
    "timestamp_text": "12/08/24, 23:39",
    "sender": "Suyash",
    "message": "These folks killed it",
    "type": "message"
  },
  {
    "timestamp": "2024-08-12T23:40:00",
    "timestamp_text": "12/08/24, 23:40",
    "sender": "Vani Subramaniam Heritage Walk",
    "message": "Nobody killed it\nWe survived cuz of suyash",
    "type": "message"
  },
  {
    "timestamp": "2024-08-12T23:40:00",
    "timestamp_text": "12/08/24, 23:40",
    "sender": "Vani Subramaniam Heritage Walk",
    "message": "And enthusiastically asked for shots",
    "type": "message"
  },
  {
    "timestamp": "2024-08-12T23:40:00",
    "timestamp_text": "12/08/24, 23:40",
    "sender": "Suyash",
    "message": "Listen if you folks weren't there, we would have been 4th at best",
    "type": "message"
  },
  {
    "timestamp": "2024-08-12T23:41:00",
    "timestamp_text": "12/08/24, 23:41",
    "sender": "Suyash",
    "message": "Lol I pitched Saturday's walk to the quizmaster",
    "type": "message"
  },
  {
    "timestamp": "2024-08-12T23:41:00",
    "timestamp_text": "12/08/24, 23:41",
    "sender": "Vani Subramaniam Heritage Walk",
    "message": "Call me for Bollywood quiz 🤣😭\nWill make it rain",
    "type": "message"
  },
  {
    "timestamp": "2024-08-12T23:41:00",
    "timestamp_text": "12/08/24, 23:41",
    "sender": "Suyash",
    "message": "Shall keep this in mind. I suck at it",
    "type": "message"
  },
  {
    "timestamp": "2024-08-12T23:41:00",
    "timestamp_text": "12/08/24, 23:41",
    "sender": "Vani Subramaniam Heritage Walk",
    "message": "Saw\nFull plugging and networking",
    "type": "message"
  },
  {
    "timestamp": "2024-08-12T23:42:00",
    "timestamp_text": "12/08/24, 23:42",
    "sender": "Suyash",
    "message": "Lol. I mean it'll be interesting to have a quizzer  in the mix. He may know more trivia",
    "type": "message"
  },
  {
    "timestamp": "2024-08-13T00:18:00",
    "timestamp_text": "13/08/24, 00:18",
    "sender": "Anusha YD",
    "message": "Lovely! 🤣 Sounds like it had been lots of fun!",
    "type": "message"
  },
  {
    "timestamp": "2024-08-13T00:19:00",
    "timestamp_text": "13/08/24, 00:19",
    "sender": "Suyash",
    "message": "It really was",
    "type": "message"
  },
  {
    "timestamp": "2024-08-13T00:19:00",
    "timestamp_text": "13/08/24, 00:19",
    "sender": "Anusha YD",
    "message": "Congratulations on the free shots;)",
    "type": "message"
  },
  {
    "timestamp": "2024-08-13T11:47:00",
    "timestamp_text": "13/08/24, 11:47",
    "sender": "Suyash",
    "message": "https://www.linkedin.com/posts/suyash-kumar-marketing_bengaluritage-history-bengaluru-activity-7229004744474697728-heVI?utm_source=share&utm_medium=member_android",
    "type": "message"
  },
  {
    "timestamp": "2024-08-13T12:04:00",
    "timestamp_text": "13/08/24, 12:04",
    "sender": "Suyash",
    "message": "Hey anyone here familiar  with any person or organisation conducting heritage walks in Kochi?",
    "type": "message"
  },
  {
    "timestamp": "2024-08-14T20:12:00",
    "timestamp_text": "14/08/24, 20:12",
    "sender": null,
    "message": "Septhar Bengaluritage Walk requested to join.",
    "type": "system"
  },
  {
    "timestamp": "2024-08-14T22:18:00",
    "timestamp_text": "14/08/24, 22:18",
    "sender": null,
    "message": "Chandeep Bengaluritage Walk requested to join.",
    "type": "system"
  },
  {
    "timestamp": "2024-08-15T11:00:00",
    "timestamp_text": "15/08/24, 11:00",
    "sender": "Suyash",
    "message": "Happy Independence Day folks",
    "type": "message"
  },
  {
    "timestamp": "2024-08-15T11:00:00",
    "timestamp_text": "15/08/24, 11:00",
    "sender": "Suyash",
    "message": "<Media omitted>",
    "type": "message"
  },
  {
    "timestamp": "2024-08-15T20:19:00",
    "timestamp_text": "15/08/24, 20:19",
    "sender": "Suyash",
    "message": "https://m.economictimes.com/magazines/panache/aga-ali-asker-the-persian-horse-trader-whose-legacy-lingers-on-in-bengaluru/articleshow/50667052.cms\n\nMuch shorter, couple of fun facts",
    "type": "message"
  },
  {
    "timestamp": "2024-08-15T20:19:00",
    "timestamp_text": "15/08/24, 20:19",
    "sender": "Suyash",
    "message": "Thank you @⁨Ankur Kayesth Masai⁩ for sharing",
    "type": "message"
  },
  {
    "timestamp": "2024-08-17T14:25:00",
    "timestamp_text": "17/08/24, 14:25",
    "sender": null,
    "message": "Raksha Nagaraj requested to join.",
    "type": "system"
  },
  {
    "timestamp": "2024-08-17T21:45:00",
    "timestamp_text": "17/08/24, 21:45",
    "sender": null,
    "message": "Rohan Kishore Bengaluritage Walk requested to join.",
    "type": "system"
  },
  {
    "timestamp": "2024-08-18T15:57:00",
    "timestamp_text": "18/08/24, 15:57",
    "sender": null,
    "message": "Esther Raj Premaka Bengaluritage Walk requested to join.",
    "type": "system"
  },
  {
    "timestamp": "2024-08-18T15:57:00",
    "timestamp_text": "18/08/24, 15:57",
    "sender": null,
    "message": "Chandeep Bengaluritage Walk requested to join.",
    "type": "system"
  },
  {
    "timestamp": "2024-08-18T15:58:00",
    "timestamp_text": "18/08/24, 15:58",
    "sender": null,
    "message": "Rohan Kishore Bengaluritage Walk requested to join.",
    "type": "system"
  },
  {
    "timestamp": "2024-08-18T16:08:00",
    "timestamp_text": "18/08/24, 16:08",
    "sender": null,
    "message": "Manika Bengaluritage Walk requested to join.",
    "type": "system"
  },
  {
    "timestamp": "2024-08-18T16:25:00",
    "timestamp_text": "18/08/24, 16:25",
    "sender": null,
    "message": "Chitbhanu Nagri SVP Razorpay requested to join.",
    "type": "system"
  },
  {
    "timestamp": "2024-08-18T16:34:00",
    "timestamp_text": "18/08/24, 16:34",
    "sender": null,
    "message": "Anand Prasad Bengaluritage Walk requested to join.",
    "type": "system"
  },
  {
    "timestamp": "2024-08-18T22:46:00",
    "timestamp_text": "18/08/24, 22:46",
    "sender": null,
    "message": "Raksha Nagaraj joined from the community",
    "type": "system"
  },
  {
    "timestamp": "2024-08-18T22:49:00",
    "timestamp_text": "18/08/24, 22:49",
    "sender": null,
    "message": "Anand Prasad Bengaluritage Walk joined using a group link.",
    "type": "system"
  },
  {
    "timestamp": "2024-08-18T22:49:00",
    "timestamp_text": "18/08/24, 22:49",
    "sender": null,
    "message": "Chitbhanu Nagri SVP Razorpay joined using a group link.",
    "type": "system"
  },
  {
    "timestamp": "2024-08-18T22:49:00",
    "timestamp_text": "18/08/24, 22:49",
    "sender": null,
    "message": "Manika Bengaluritage Walk joined using a group link.",
    "type": "system"
  },
  {
    "timestamp": "2024-08-18T22:49:00",
    "timestamp_text": "18/08/24, 22:49",
    "sender": null,
    "message": "Rohan Kishore Bengaluritage Walk joined using a group link.",
    "type": "system"
  },
  {
    "timestamp": "2024-08-18T22:49:00",
    "timestamp_text": "18/08/24, 22:49",
    "sender": null,
    "message": "Chandeep Bengaluritage Walk joined using a group link.",
    "type": "system"
  },
  {
    "timestamp": "2024-08-18T22:49:00",
    "timestamp_text": "18/08/24, 22:49",
    "sender": null,
    "message": "Esther Raj Premaka Bengaluritage Walk joined using a group link.",
    "type": "system"
  },
  {
    "timestamp": "2024-08-18T22:49:00",
    "timestamp_text": "18/08/24, 22:49",
    "sender": null,
    "message": "Septhar Bengaluritage Walk joined from the community",
    "type": "system"
  },
  {
    "timestamp": "2024-08-19T12:03:00",
    "timestamp_text": "19/08/24, 12:03",
    "sender": null,
    "message": "Harsha MV requested to join.",
    "type": "system"
  },
  {
    "timestamp": "2024-08-19T12:10:00",
    "timestamp_text": "19/08/24, 12:10",
    "sender": null,
    "message": "Harsha MV joined using a group link.",
    "type": "system"
  },
  {
    "timestamp": "2024-08-19T12:26:00",
    "timestamp_text": "19/08/24, 12:26",
    "sender": null,
    "message": "Shwetha Ops Masai requested to join.",
    "type": "system"
  },
  {
    "timestamp": "2024-08-19T14:45:00",
    "timestamp_text": "19/08/24, 14:45",
    "sender": null,
    "message": "Shwetha Ops Masai joined from the community",
    "type": "system"
  },
  {
    "timestamp": "2024-08-22T19:33:00",
    "timestamp_text": "22/08/24, 19:33",
    "sender": "Self Community",
    "message": "<Media omitted>",
    "type": "message"
  },
  {
    "timestamp": "2024-08-22T19:34:00",
    "timestamp_text": "22/08/24, 19:34",
    "sender": "Self Community",
    "message": "https://docs.google.com/forms/d/e/1FAIpQLSdhzEZdEEZOgCqHCIdzcvuy-Yd9UBQJZnI77cVtkM-o9qzs9g/viewform",
    "type": "message"
  },
  {
    "timestamp": "2024-08-22T19:34:00",
    "timestamp_text": "22/08/24, 19:34",
    "sender": "Self Community",
    "message": "So bummed that I'll miss this",
    "type": "message"
  },
  {
    "timestamp": "2024-08-22T19:35:00",
    "timestamp_text": "22/08/24, 19:35",
    "sender": "Arundhati Raaj Bengaluritage",
    "message": "Thanks for sharing!",
    "type": "message"
  },
  {
    "timestamp": "2024-08-23T14:59:00",
    "timestamp_text": "23/08/24, 14:59",
    "sender": "Suyash",
    "message": "<Media omitted>",
    "type": "message"
  },
  {
    "timestamp": "2024-08-23T14:59:00",
    "timestamp_text": "23/08/24, 14:59",
    "sender": "Suyash",
    "message": "Folks please get in touch with @⁨Raksha Nagaraj⁩ for this",
    "type": "message"
  },
  {
    "timestamp": "2024-08-23T15:00:00",
    "timestamp_text": "23/08/24, 15:00",
    "sender": "Suyash",
    "message": "She runs Bengaluru Prayana\nhttps://www.instagram.com/bengaluruprayana?igsh=aGMwZnM2eXo1YW13",
    "type": "message"
  },
  {
    "timestamp": "2024-08-23T15:00:00",
    "timestamp_text": "23/08/24, 15:00",
    "sender": "Suyash",
    "message": "She's doing many awesome walks",
    "type": "message"
  },
  {
    "timestamp": "2024-08-23T15:01:00",
    "timestamp_text": "23/08/24, 15:01",
    "sender": "Raksha Nagaraj",
    "message": "Thank you Suyash. Really appreciate the shoutout.",
    "type": "message"
  },
  {
    "timestamp": "2024-08-23T15:01:00",
    "timestamp_text": "23/08/24, 15:01",
    "sender": "Suyash",
    "message": "Most welcome",
    "type": "message"
  },
  {
    "timestamp": "2024-08-23T19:54:00",
    "timestamp_text": "23/08/24, 19:54",
    "sender": null,
    "message": "Sharon Bengaluritage requested to join.",
    "type": "system"
  },
  {
    "timestamp": "2024-08-24T19:45:00",
    "timestamp_text": "24/08/24, 19:45",
    "sender": null,
    "message": "Sanaah Jain HR Executive Rigi requested to join.",
    "type": "system"
  },
  {
    "timestamp": "2024-08-24T20:33:00",
    "timestamp_text": "24/08/24, 20:33",
    "sender": null,
    "message": "Sharon Bengaluritage joined using a group link.",
    "type": "system"
  },
  {
    "timestamp": "2024-08-24T20:33:00",
    "timestamp_text": "24/08/24, 20:33",
    "sender": null,
    "message": "Sanaah Jain HR Executive Rigi joined using a group link.",
    "type": "system"
  },
  {
    "timestamp": "2024-08-25T11:13:00",
    "timestamp_text": "25/08/24, 11:13",
    "sender": "Suyash",
    "message": "<Media omitted>",
    "type": "message"
  },
  {
    "timestamp": "2024-08-25T11:13:00",
    "timestamp_text": "25/08/24, 11:13",
    "sender": "Suyash",
    "message": "https://www.deccanherald.com/india/karnataka/experts-discover-errors-in-content-on-kannada-inscriptions-3163418#google_vignette",
    "type": "message"
  },
  {
    "timestamp": "2024-08-25T11:14:00",
    "timestamp_text": "25/08/24, 11:14",
    "sender": "Suyash",
    "message": "\"At least 20 per cent of all content in previously studied Kannada inscriptions in the state potentially contains errors, experts have said, a discovery that has already set right some anomalies.\"",
    "type": "message"
  },
  {
    "timestamp": "2024-08-25T11:23:00",
    "timestamp_text": "25/08/24, 11:23",
    "sender": "Suyash",
    "message": "The History Of Bangalore: How We Discovered The History Of Bangalore\n\nMedia file: https://pdst.fm/e/chrt.fm/track/2B4E6F/traffic.megaphone.fm/SOLMOONEYMEDIA3412279895.mp3?updated=1715604736",
    "type": "message"
  },
  {
    "timestamp": "2024-08-25T11:24:00",
    "timestamp_text": "25/08/24, 11:24",
    "sender": "Suyash",
    "message": "Do give this a listen to learn a bit more about inscriptions in Bangalore and Karnataka",
    "type": "message"
  },
  {
    "timestamp": "2024-08-25T11:25:00",
    "timestamp_text": "25/08/24, 11:25",
    "sender": "Chandeep Bengaluritage Walk",
    "message": "\"However, it is important to note that not all of the corrections have equally significant impacts; a majority of them are orthography corrections that don't substantially alter the meaning of the earlier readings,” Udaya Kumar told DH\n\n\"Well that's a relief\"",
    "type": "message"
  },
  {
    "timestamp": "2024-08-25T11:25:00",
    "timestamp_text": "25/08/24, 11:25",
    "sender": "Suyash",
    "message": "Indeed",
    "type": "message"
  },
  {
    "timestamp": "2024-08-26T12:29:00",
    "timestamp_text": "26/08/24, 12:29",
    "sender": "Sanaah Jain HR Executive Rigi",
    "message": "Hi everyone, Sanaah this side!\n\nI'm excited to join this group. Originally from Agra, I've been living in Bangalore for a year now and currently work as an HR professional at a startup called Rigi. While history isn’t my usual focus, I like meeting new people and learning new things, which is what brought me here.  I’m really looking forward to exploring more of this amazing city and connecting with all of you!",
    "type": "message"
  },
  {
    "timestamp": "2024-08-26T13:57:00",
    "timestamp_text": "26/08/24, 13:57",
    "sender": "Anusha YD",
    "message": "Welcome Sanaah!",
    "type": "message"
  },
  {
    "timestamp": "2024-08-26T13:57:00",
    "timestamp_text": "26/08/24, 13:57",
    "sender": "Suyash",
    "message": "Welcome to Bengaluritage Sanaah!",
    "type": "message"
  },
  {
    "timestamp": "2024-08-28T16:49:00",
    "timestamp_text": "28/08/24, 16:49",
    "sender": "Suyash",
    "message": "Eroteme, the official Quiz Club of JNC, is planning to host our first Open Quiz on the 29th of August at 3 PM. This quiz will be on the culture and history of Namma Bengaluru, and winners will recieve cash prizes. \nTeams will be of 2. \nTop 6 will go through to finals, after prelims.\nVenue: Room 39\nJyoti Nivas College Autonomous, Hosur Road, Koramangala. \n( https://maps.app.goo.gl/co3nCpvK49RMGYVs9 ) \nTime: Prelims will start @ 3PM\nDate: 29/8/24\nFor any queries, contact: +91 95387 62680 / +91 97414 20508",
    "type": "message"
  },
  {
    "timestamp": "2024-08-28T16:49:00",
    "timestamp_text": "28/08/24, 16:49",
    "sender": "Suyash",
    "message": "<Media omitted>",
    "type": "message"
  },
  {
    "timestamp": "2024-08-28T16:49:00",
    "timestamp_text": "28/08/24, 16:49",
    "sender": "Suyash",
    "message": "Follow up note for the blr quiz @ jnc tomorrow. Please keep in mind the institution has a dress code. Do not show up in shorts/anything that might make them turn you away. \n\nFor any queries, contact: +91 95387 62680 / +91 97414 20508",
    "type": "message"
  },
  {
    "timestamp": "2024-09-03T12:50:00",
    "timestamp_text": "03/09/24, 12:50",
    "sender": null,
    "message": "You added Achyut Karol Bengaluritage, Akash Chandra Bengaluritage, Chinmaya Chetan Parida Bengaluritage, Hashmita Dua Bengaluritage, Herobir Ngangom, Monira Sultana Bengaluritage, Priyank Singh Bengaluritage, Sarabjeet Bengaluritage, Sarthak A Bengaluritage and Sudeep Mandal Bengaluritage",
    "type": "system"
  },
  {
    "timestamp": "2024-09-03T12:53:00",
    "timestamp_text": "03/09/24, 12:53",
    "sender": null,
    "message": "Vasudha Kaul Bengaluritage joined using your invite",
    "type": "system"
  },
  {
    "timestamp": "2024-09-03T12:55:00",
    "timestamp_text": "03/09/24, 12:55",
    "sender": "Vasudha Kaul Bengaluritage",
    "message": "Hey folks!\n\nThis is Vasudha, have been in Bangalore since 2 years now, excited to be a part of your Heritage walks! ✨😄",
    "type": "message"
  },
  {
    "timestamp": "2024-09-03T13:03:00",
    "timestamp_text": "03/09/24, 13:03",
    "sender": "Self Community",
    "message": "Welcome to Bengaluritage Vasudha",
    "type": "message"
  },
  {
    "timestamp": "2024-09-03T13:03:00",
    "timestamp_text": "03/09/24, 13:03",
    "sender": "Sarthak A Bengaluritage",
    "message": "Hello, Sarthak this side! I’ve been living in Bangalore for last 2+ years and I’m excited to be a part of this!",
    "type": "message"
  },
  {
    "timestamp": "2024-09-03T13:12:00",
    "timestamp_text": "03/09/24, 13:12",
    "sender": "Chinmaya Chetan Parida Bengaluritage",
    "message": "Hi guys,\n\nChinmaya Side and I am running a Marketing Agency called \"Qurious Brains\".\n\nExcited to be a part of this.\n\nCheers🎊",
    "type": "message"
  },
  {
    "timestamp": "2024-09-03T13:15:00",
    "timestamp_text": "03/09/24, 13:15",
    "sender": "Suyash",
    "message": "Welcome folks",
    "type": "message"
  },
  {
    "timestamp": "2024-09-03T13:16:00",
    "timestamp_text": "03/09/24, 13:16",
    "sender": null,
    "message": "Hashmita Dua Bengaluritage: This message was deleted",
    "type": "system"
  },
  {
    "timestamp": "2024-09-03T13:18:00",
    "timestamp_text": "03/09/24, 13:18",
    "sender": null,
    "message": "Fayaz PK Bengaluritage joined using your invite",
    "type": "system"
  },
  {
    "timestamp": "2024-09-03T14:04:00",
    "timestamp_text": "03/09/24, 14:04",
    "sender": "Hashmita Dua Bengaluritage",
    "message": "Helllo Helloo \nEvenyoneee! \nThis is Hashmita Dua! \nI am a bit new to Bangalore! \nExcited to explore the beauty of Bangalore with you guys❤️",
    "type": "message"
  },
  {
    "timestamp": "2024-09-03T14:12:00",
    "timestamp_text": "03/09/24, 14:12",
    "sender": "Monira Sultana Bengaluritage",
    "message": "Hey everyone! This is Monira. Been in Bengaluru for more than 2 years. Essentially an avid traveler but haven't been able to explore much of this city yet. Excited to be a part of this group and hopefully discover its unique heritage and culture alongside you all!🙌🏻",
    "type": "message"
  },
  {
    "timestamp": "2024-09-03T15:50:00",
    "timestamp_text": "03/09/24, 15:50",
    "sender": "Achyut Karol Bengaluritage",
    "message": "Hello everyone! I am Achyut Karol, I work in marketing. I have just shifted to Bangalore a month back. Excited to explore the city. 🥳",
    "type": "message"
  },
  {
    "timestamp": "2024-09-03T16:33:00",
    "timestamp_text": "03/09/24, 16:33",
    "sender": "Priyank Singh Bengaluritage",
    "message": "Hello, thanks for adding me here @⁨Suyash⁩ \n\nI’m Priyank, I have been in Bangalore for 2-ish years, completely in love with the city and its people",
    "type": "message"
  },
  {
    "timestamp": "2024-09-04T09:18:00",
    "timestamp_text": "04/09/24, 09:18",
    "sender": "Suyash",
    "message": "<Media omitted>",
    "type": "message"
  },
  {
    "timestamp": "2024-09-04T09:18:00",
    "timestamp_text": "04/09/24, 09:18",
    "sender": "Suyash",
    "message": "This is for Delhi",
    "type": "message"
  },
  {
    "timestamp": "2024-09-04T09:18:00",
    "timestamp_text": "04/09/24, 09:18",
    "sender": "Suyash",
    "message": "An informative brochure by the World Monuments Fund provides a brief overview of the Tughlaqabad Fort. A quick read will give you a basic understanding",
    "type": "message"
  },
  {
    "timestamp": "2024-09-04T09:19:00",
    "timestamp_text": "04/09/24, 09:19",
    "sender": "Hashmita Dua Bengaluritage",
    "message": "Do we have any heritage walks coming up this weekend in Bangalore? @⁨Suyash⁩",
    "type": "message"
  },
  {
    "timestamp": "2024-09-04T09:19:00",
    "timestamp_text": "04/09/24, 09:19",
    "sender": "Suyash",
    "message": "Sep 14. Shall announce further details today",
    "type": "message"
  },
  {
    "timestamp": "2024-09-04T11:17:00",
    "timestamp_text": "04/09/24, 11:17",
    "sender": "Priyank Singh Bengaluritage",
    "message": "Love this place",
    "type": "message"
  },
  {
    "timestamp": "2024-09-04T11:42:00",
    "timestamp_text": "04/09/24, 11:42",
    "sender": "Suyash",
    "message": "Hi guys",
    "type": "message"
  },
  {
    "timestamp": "2024-09-04T11:42:00",
    "timestamp_text": "04/09/24, 11:42",
    "sender": "Suyash",
    "message": "<Media omitted>",
    "type": "message"
  },
  {
    "timestamp": "2024-09-04T11:42:00",
    "timestamp_text": "04/09/24, 11:42",
    "sender": "Suyash",
    "message": "Announcing my next walk",
    "type": "message"
  },
  {
    "timestamp": "2024-09-04T11:43:00",
    "timestamp_text": "04/09/24, 11:43",
    "sender": "Suyash",
    "message": "Please block your spot here - https://dhvo.short.gy/BengaluritageMG",
    "type": "message"
  },
  {
    "timestamp": "2024-09-04T16:29:00",
    "timestamp_text": "04/09/24, 16:29",
    "sender": "Suyash",
    "message": "POLL:\nHave you read Sherlock Holmes?\nOPTION: Yes, it's elementary (8 votes)\nOPTION: No (2 votes)\n",
    "type": "message"
  },
  {
    "timestamp": "2024-09-04T21:07:00",
    "timestamp_text": "04/09/24, 21:07",
    "sender": "Chandeep Bengaluritage Walk",
    "message": "Possibility of a book reading session? or discussion about it perhaps @⁨Suyash⁩ ?",
    "type": "message"
  },
  {
    "timestamp": "2024-09-04T21:07:00",
    "timestamp_text": "04/09/24, 21:07",
    "sender": "Suyash",
    "message": "Will definitely try",
    "type": "message"
  },
  {
    "timestamp": "2024-09-04T21:08:00",
    "timestamp_text": "04/09/24, 21:08",
    "sender": "Suyash",
    "message": "But the reason for this question is that there's a character in one of the stories linked to Bangalore",
    "type": "message"
  },
  {
    "timestamp": "2024-09-04T21:08:00",
    "timestamp_text": "04/09/24, 21:08",
    "sender": "Suyash",
    "message": "Anyone remembers a character called Col. Sebastian Moran?",
    "type": "message"
  },
  {
    "timestamp": "2024-09-04T21:09:00",
    "timestamp_text": "04/09/24, 21:09",
    "sender": "Suyash",
    "message": "He was 2nd in command to Moriarty. In the story, Holmes described him as the 2nd most dangerous man after Moriarty",
    "type": "message"
  },
  {
    "timestamp": "2024-09-04T21:10:00",
    "timestamp_text": "04/09/24, 21:10",
    "sender": "Suyash",
    "message": "Anyone remember this?",
    "type": "message"
  },
  {
    "timestamp": "2024-09-04T21:11:00",
    "timestamp_text": "04/09/24, 21:11",
    "sender": "Chandeep Bengaluritage Walk",
    "message": "Read adventure of empty house few years back. I think he's the main antagonist of that part",
    "type": "message"
  },
  {
    "timestamp": "2024-09-04T21:21:00",
    "timestamp_text": "04/09/24, 21:21",
    "sender": "Suyash",
    "message": "Yup exactly",
    "type": "message"
  },
  {
    "timestamp": "2024-09-04T21:22:00",
    "timestamp_text": "04/09/24, 21:22",
    "sender": "Suyash",
    "message": "Well the character was mentioned to have been in the British Indian Army and belonged to the 1st Bangalore Pioneers",
    "type": "message"
  },
  {
    "timestamp": "2024-09-04T21:27:00",
    "timestamp_text": "04/09/24, 21:27",
    "sender": "Chandeep Bengaluritage Walk",
    "message": "ohhh nice!!",
    "type": "message"
  },
  {
    "timestamp": "2024-09-04T21:30:00",
    "timestamp_text": "04/09/24, 21:30",
    "sender": "Suyash",
    "message": "While Bangalore Pioneers never existed, it was based on Madras Pioneers which made Bangalore it's home in the early 1800s",
    "type": "message"
  },
  {
    "timestamp": "2024-09-04T21:31:00",
    "timestamp_text": "04/09/24, 21:31",
    "sender": "Suyash",
